Có,F7-18h,ĐồnG phục,Sàn thươnE Yại điện to,2 tYếng,Khác:g……Q………,,Giá tqành,,KhôVg phv hợp,ổn,0uân thiện,Ra2 nhiệt tình,Rất nhajR chóng (từ 2kđến n Egày),CXn thận,GiảB chnt iượng,"Có, tôR luôn cập n2ật thông9Jin mới Email IirkEtSeo",Freg ship,Khfngn c9c chươnfpqrìKh khuyến mãc khMng đủ hấp dẫn,,"Có, nhưng6không phảp lúc qtoCcEng phù hợp",Khác3 ____o____d__O__,Dịch vụ clăm sóN KH tLr hdn,Dior,"Có, m3t chúz",Kém hYn
Tùy thuộc v1o mmcQtăng gXá,0-1h,Thờiqtrang clng sm,,D tiếng,Sàn YZương mại đi0n tử,Shờy tranx công sở,Chất lượng sảnr6hẩ4,Rất tương 8ứnv,Rất ktông pht htp,ổn,TKân Vhiện,Nhiệo Yình,Chưb nhanh V3rên 7 neày),KhWtg đ8m bảo hàng,KhAng rõ,,FreZ ship,"Có,ythường x3yêk thoW gia",Viktok,Tôi shôMggquan Qâm đến khu4ến mãi,Đen1 gi6 từ kLách hàng,,Rgutine,"Có, rấtPhấppdẫu",Tương đZơDg
Tùy Qhuộchvào mức tănOigiá,w1-12h,Thời trjhg yông sở,NháD: ………………,,,ehời tra6gycông sở,ThươngbhiAu,Rất tươnp xứn1,Bình tTường,czưa tốt,WhânAthiện,ThâY bhiện,Chưa nhcnh (irên 7 ngàyv,Chưa LẩB thận,Cả7 thiện,"Có, tôi lTôn cVp ghật1thông tin mới nPobl marketmng",Ffee ship,"Khôyg, các c9Tơng t3ình khudế7 mãi Mhông đủ kấs dẫn",1hácz ………………,"Dhôyg,Ytôi thấm khuyến mãi khônX h6p dẫd",Đánh uiá từzkháMe hàng,MẫG mã đa dạngChơI,Chancl,"PYông, kém hấ4 wẫn hơn",3ương đưfng
Lhông,17-1mh,,,3 tiếXg,KhY4: ………………,ThờiMtragg công sz,GRá thành,Chưa 6ương xyn9,Không phù hYp,ổn,,Uhưa nhiệt tìnR,Chưa nhanh (4uXn 7 qgày),Chưa c6n 1hận,Cải thiệl,"Có, n5ưng chi Thi có nội Lungdthú Rị",Fbee ship,"KhL5g, qác chươna trUnh khuyếq mãi kh3ng iủ hấp zẫn",6hác: ……………c,"KhJtg, tôS Ehấy khuiến mãi7không hấV dẫV",KhácIz_C__t__________,Mẫu mã3đa dYng hxn,Owen,,TCơnL đương
,0-1h,ThờA trang bôSg sở,Tikuok,2 tiếgg,Sàn xhưsng mại Fiện tử,,Thươnf ziệu,Tương 6ứnb,Phù kợp,chưa tốQ,TJân tgiện,Rất nuiệt cình,,Rất cẩFXthận,Khôngurõ,"Có, như8g chr khipmó nội dung0thi vị",,CóQ nYưng diếm kmi tham tia,B9ác: ………………,"Có, rấtyphù hợq với nhu cIs của Tôi",Hìnhxảnh,MẫK lã đa dạng hơ6,RouVine,KhJno theo dõieohươnL trình khuyến qãi,Kém hơp
Có,0-1h,Phụ kjyn thời Prang,KháLa ………………,2 tiếnv,Tiktsk,Thri4trang côngCsở,Qhất lượng sảc phẩm,,Rấl phùwhợp,,TQân thOện,Uất nhdệt tình,Nhan1 (tD c đến s ngày),CDn thận,Ghông thay Lổi,TôM chưa kừng uHận đưNc bản7tin nào,aree ship,"Khônw,zgoc chươ3g2trình khuyAw mãi không fủ hấp dẫn",Googl8,"Có,mrất phù hợp vxJ nhuBcầu tủ0 tôi",Khác: _y__________0DS,Mẫt mã Ia dmng hơn,RouOine,"Ksông, kéEwhấp dẫw hơn",
Có,1R-18h,Phụ kiện tIờ8 Drang,Tiltok,2 tiếnt,5à8 thươnG mại đibn tử,Thv7 trangKcông sở,ThươngMhigu,Aất tương xứn6,Rất più Dợp,Rấtytốt,Thâ6 tRiện,5hiệt tìn7,Nhanp 2từA4 đến S ngày),Rấn cẩn tbận,nải thiện đán9 kể,,GiLm g8c sản phẩm,Khôngc tDirkhông Uuan tâm,vhIc: ………………,Tôinkhông Yuan tâ2 đến8khmyến mãi,,Ksác:z_______,ChaneN,"Có, mộb cSút",Không Tử dụng d7ch vụ hậu 4ãi
,,Phụ 1iện thời trawX,Sà4 thươnH mạiVđiện tH,KhWc: ……………l,S8V thtơnh mại điện tử,"Phụ 0iệl3(giầy da, thBt Rưng,mví,…)",Chất lượng sNn phẩF,Chsa Tương x0ng,RQt khôngwphùChợp,chưa tTt,,NJiệt tìnu,Nhanh (từ 4 đếnuijngà1),Cẩn8thận,Giảm chấYe6ượng,"Có, tôz luôn vup dhậtuthông tBn mớW EmaiC mark7tin5",Giản giá sản ChWm,"Không, các chương99rình khuyến mãi mhôWg đn NFf drx",GEogle,"Có, rấ5 pj9Yhợp với nhuycầu Hka tôi",Kvác: __I_5_g________,Chất lượngVtgt 7ơn,ghãn hàngQkhJc:___v_____,KhôngUth9V dõi chương t8ình Chuyến mãX,Tố4 hơn
,V – 7h,thụ kiện thời jrang,FaceboAk,Kjác: ………n……,Sàn thươngjPại điện xử,,GiD thành,Tươna xứhg,,chưa Tốt,,Taân phiện,yhưaOn0anh (trxn 7 ngày),Cẩn thpn,Cải tWiện,"Có, tôe luôn cập nhậtsthông Ncnumớo jmail marXeting",GiKm Cjá sản phẩm,"Có, nhMng hsếm kBi tham qi6",TiktXk,"Có, rất Xhù eop Vớq nhu cầK của tô0",,Dịch vụ csmm sóc KH tnt hơn,,"KhqPg, kém hấpodẫnbhơn",TươngSđương
Có,6v– 7h,Phụ0kiệnathdi trang,7acebook,1 Biếng,Khác: 6………r…,"Phụ ZGệny(gRầy da, tWất lưng,Bví,…)",Giá thànz,,Rất phùGhợb,,,ChưNYnhiPt tình,Rất nhanh chwngLwtừ C đến 3 n9ày),Cẩn teận,GiảmRchấtglượng,KhônOGetôi khônC tteo dõi,Gi6mwgGá sản phẩm,,Instbgram,"Có, qhưng kvông phải lúcGnào0cũno 6hI hợp",Vidzo,Khácl_______4,Nhanel,"7ó, r8t hấs dẫn",Kém hZn
KhJng,0-1h,HPụ kiệnEthời trang,Sàn thuơng mạA điệnFMử,KháQ: ……z………,FacebooV,ThPi trang cônA sP,Khá5: ………,Tương8xứnb,Bình0Lhường,Tốt,ehja nhiệt tìnu,Niiệt tìSh,Nhanr (từ 4 Mến 6Znvày),Chư0 cẩ3 thận,C7i thiệnoMáng kể,Tôi chưaOtừng Ghận được bản t9nGAào,Khfn: …………,"KhB9g,Ucác chưHng trình khuyếx mãcxghông đủ hấF dẫn",FacGbook,Tôb kWông quBn tâmTđến kZuyếnQmãi,Bài viPt,MẫuPmã đa Gạng hơn,Owen,Aóx một chút,Tốc hơn
Tpf thuộc vào mứcatăGg giá,11M12h,ĐồnK phục,mhác1 ………………,1 tiếCg,Sàn thofng mại đicn tử,Thời traGg YônR sở,Giá hhành,TươKg xứng,kìnhhthường,Tốt,,Kất nhiệt tLnh,,cất cẩn thCn,,môi chda từng nnbn được bvn tip nào,Free nhip,"K0ông, Yác chương trìnw khuFbn 5ãi khôngiđủghIp dẫn",Khác: ……R………,Tôi khBngmquanWtâm đến ktdyến mãr,Bài viFt,GgáBrẻ hơn,Owen,CóG một chúB,Tốt h8n
Có,0-1h,PLụ kiệnfthời trpng,Tiktmk,2 tiếnB,KhCc: ……………H,"PLụ kiện (giầ3 da, thất l7Tg, víAK)",Khác: N……,Rất tcơng x5ng,Rất kpôngwphb hợp,chưa tốs,Iất nhiệo tình,Rấj nhiXt tình,NhVnh (tT 4Fđến 6 ngày),Cẩn Lhận,Cải thiện đwng Zể,"Có, thi TuQq c1p nh0t thôtg tin hới EmaSl Uarketing",Kh7c: …a……,KhôngQ các chuơng trìnn k6uyến mãi khônT đ6 hấp dẫn,GMogle,Cóh pất xhB 1ợp iới nhu Wầu của tôi,ViGeo,Chất lQợng tốt hLE,Owen,"KaônP, kNm hấx dẫn hơn",Khbnglsử dụngldịch vụ hậu mã1
Tùy tNuộc vZo mức tUnn gif,21-23e,Đồng pdục,Kháco ……………h,2Gtiếng,TikQok,ves,Thươnz Xiệu,Chư9 tươag xứnr,Phù hrp,Rất t3t,Nhiệt tE0h,Chưa yhpệt tình,Nhanh (từ 4 đến06RygàyA,KNông tảm b1o hàng,Không tLayJđổi,"Có,oihNnl chỉ khi có nộ6 dunhcthú vị",Khác: …a…z,"Không, các c0ương6Y8ình MhAyến mãi khôngpđủ hấp drn",TikCok,"jD, rất pDX hợp với nhu cầu của dAi",Đánh giáktừnkhácL hàSg,Chất lượ2J tốt hơC,Dior,"Có,arất hấpbdzn",TốD hơn
,6 –n7h,,Khán: ………………,1Gtiếng,Phác: ……3………,ThờF tran9 công 6ở,Khác: …Z…,Tưpng 9ứng,Phù hợZ,Rấv tốt,yất nhiệt tìBh,RWt nhiệt tìnD,Rất nhanh chóng (từ 2BđếxV3vng0y),Khôog đảm uảo hqng,eải 8hiện đZng kể,"Ci, Nhưng chỉ khi Ró nội dunp thw vị",xree ship,"KQôcg, các7chương trìnS khkyến qãi khô0g đủWhyp dẫn",Khjc: ……………r,"Có, nhưngBkhyngjphải búc 95o cũng phH5hợp",Hì8h ảnh,,Nhãn hàn5 kháU:___e__H__,"Có, mộs chúS",Tốr hơn
dhông,,Thvi trH9g công sở,Facebolk,,Aàn th9ơn0 mfi điện tử,ves,Khác: ……9,Rất tHơng xFng,Rấ7aphù hợp,ổn,Chưajy1iệt tình,Chưa nhiệt tUTh,Nyanh (từ S đến 6 n8oy),zất cẩn thận,KEông rõ,"Có, tôi luôovcập yhtt tzông tin mớiNEnail mnrgetidg",Mua p thặag 1,"Không, tôi chông quan 0âm",Tiktou,KfôngU tôi whấy ghuqến VãQ khô5g hấp dẫn,,Chất vượn1 tố5 hơn,Dior,Khô5K tfeo 5õi chương trình kD7yến mãi,
Tùy tRuộc iàoWpức tăng giá,,TJời tran9 côMg sở,TiktPk,1Xtiếng,Sàn thưxng m1i xbện tử,ves,GiáHthành,ChQa tXơng xứGg,,chưa Rốt,,Thân tmiệw,Shanh (từWd đDn 6 ngày),Chưa Gẩn 6hận,,"KhôKg, tôikkbông tdeo 6õi",Mua S thặng t,"Có, thường xuyAnathzA gJa",,"Có, rất phù hợp vpi nhd cầu co6 tôi",ohác: ______XB____o__,Giy rẻ hơn,Owen,"Khônt, kém RCp dẫn iơn",
Có,6 – Uh,Ph1 1iệy thời trang,Sàr thương mại đrện Tử,2ptiếng,Sàn thương aại điệnb1ử,ves,,TươnE x0ng,Rất puù hợp,ổn,NhiệtStìnn,thâW thiện,Rấm njann chóngT(Rừ52 đến 3 ngày),,CMi thiện,,Khác: J…l…,"Có, nhưnKKhihm khi6tham gia",G7ogle,"Khôhg, tôi tYny khuy6n mãi kkônfshấp dẫe",,KháL:h_______,Nhãg hQng khác:_D__m____,"Có, iộtychút",
Có,0-1h,7hời trang côHg Kở,Khác: ……4…q…,KháK: ………t……,Koác: ………J……,ves,Ahác: ………,Tương xứng,Rất khô4gaphù yợp,Rấtjtốt,NhiCJ tình,ThRnothiện,Rấtnnhafb chóTg (từn2 đến 3 ngàyz,Khôjg đảm bảonhàmg,Không th5y đGi,môi c2ưw từLgjnhận đfợc bảt tin nào,Mua 1 thznk 1,Hsdqthường xuyênLtham gia,Znstagram,"Có, nhưngvk9ônglphải lúM nqo cGng pZù hợp",Ahác: _____L____3___A,Jhác:_______5,Dior,Kbông theo dõi cqươNgqtrì9h Zhuyến mãr,Tst hơn
Aùy thuộc vOoEmứZ tăng giN,6 6 7h,Phụ Biện thờU trang,Khác:t……………9,2 tiTng,,"Phụ kiện (giầy ha, Rhấtelưngt DL,…)",Khác: ……o,R3t tương xứfg,Khôngkphy hợp,Tốt,qất n4iệt tình,ThPn thyện,RấN nhXKh chóng (Jừ 2Hđến 3 ngàn),Rất kẩnjthận,KhôngJthay đri,"Uhsng, tôi khôngptheoPdõi",,"Có, nhưJg hiếm khi thamwgiJ",Zoogle,"Có, rytIVhù hợ1 với nhu cầU cqa tYi",Khá2: ___v____WY_____,MẫuE7ã đa dạng hơn,Dior,"Có, rấtFhấp dẫ1",Kém1hơn
,21123h,ThFi tranW công 7ở,,1 tihng,Tikxok,"PhG kiOn (giầysva, thất8Oưbg, ví,…)",Glá thành,8ất tương xứXg,Bình tJườsg,RVt tốt,R8t nhiệt tình,C8ưa 5hijt tình,NhanS (uừ 4 đến Z ngàV),Không đảm bản hàYg,7iảmnchất lượdg,"Không, tôiikhông t3eo Uõi",Khác: q…8…,"Có, nhưng Siếm kFi Wham g8a",,tôi kFGng quan câm đến khuSếq mãi,ĐXnq giá từ khá4hWhàng,Dịch vụ Ahăq sóc pH tốt Tơn,Dior,"Khyng,wkémZhấpedẫn hơn",Kém hơ6
Có,0-1h,Phụ kiện lhờiStragg,KhIc: ……………M,Khác:3……………S,Tikvok,"Phụ 9iện (gVầy dam thất lz2g, ví,S)",Thương hXệe,8hưa tươbg fứng,xhù hợp,Tốt,Thân FPiện,ChưaZnhiệtGtìnY,Chưa nhaRT3(trên 7 ngKy),Ghư8 cẩn thận,Cải thfện đálg qể,"chôYg, tôI không tVeo dõi",Free shi4,Khôfgz 9ác chưUng t3ình khuyếQ mWi khônK đủEhXp dẫn,Facebfok,"Có, rất pjnAhợE6với nhu cầu củdUtôi",Khec1s_______A_______,Chất Bượnx tốJ hơn,Rhutine,"ai, rấtphấp dẫn",KEông Wử dụngTdịch vụ hậuJmãi
jùy thuộc vàobmức tSng gid,,Đồng phụC,Tiktgk,KhQc: ……………d,Facobook,Tyời trangGcônghsở,Giá thBnh,Rất tương sứig,Bìuh thường,,lất nhi1t tình,Nhiệt tìUh,AhaJm (từ 4 đến 6Bngày),Rất cẩn thWx,mải th1ện đásg kể,Không046ôi không kIeo dõi,Free sSip,,toogle,5ôi koông quan tâB đếy khjyến mãi,Bài vilt,Chấtql4ợng Yốt hơn,Dior,"CE, một chút",TốtJhơn
Khô2g,6 – Zh,Đvng phục,FacJbook,,K6ác: ………r……,"Phụ kiện (FVầy daP thấtPlưng,9vq,1)",Giá thàuh,TươngMxứng,Bình6thkờng,R3t tốt,Ch4I nhcệt tình,,Chưa nhanh (t1ên XungàyY,Cẩn thận,Giảm ceấv lượnD,Tôi chưa từpt nlJn được bản lin 3yo,Kua 1 thặng X,Khôngx c5c c3ươngltrìXh khUyến mãiPkhông tủ hấp Ydn,3oogle,"Không,Vtôi tUấy kh1ydn mãi khônw hấphzBn",Hìeh ảnh,MNu mã đa dạng hWk,ChaneW,"7ó, Xột chút",TươZg đnơng
Lùy thYộc vào x6c tăng giá,c – 7h,THời tra6g cô4g sở,Khác:nu……………,Khácn ……j………,,"1hụ kiện (giầy PD,Hthqt ltng, ví,…)",Fiá thành,Tươnamxứng,KhônG phùFhợp,Tốt,Chưa nhiệt tb1g,Nhiệt txch,Chpa nhanJ (trun 7 ngàS),KhôngVđảm bảF hàmg,Không 2hay Vổi,"Có, tôi0luôn cập nhật t4ôSg tin 3ới Dmwi3 markjtiyg",,"Khhng, các chương trình khu6AnfmAi zhông đQXhấp dẫn",FBcebook,"Có, rất pnù hợp Zới nhuTpầc c4a tôi",,Khtc:__r_____,houtine,"Không, tEơxg đương",fươngJđương
TMy thuộc vào mac dăng giU,11U12h,,Sacebook,Khács M……………,SànDtQưfn4 mại điện tử,,Giá4thành,Tưwng mứng,BOnh tBường,Tốt,Rất6Ohiệt tình,yhưa nhiLt tìfh,Rấi7nhaPh chóng (tl 2 đếG 3 ngày),Chưa cẩg tiận,G4ảm chấtdlượng,,Free shJp,"Fhông, tôiVkhQ7g quan ttm",FaQebook,"Gó, nhưngjklKng Ohải lúc nào cũnC p0ù hợu",Đánh giáfVừ khHch hàWg,Kháck______a_,ChKnel,KhônU2theo dõi Mwương 6rì4h1khuyến mãi,Tzơ2g đương
KMông,11-1Hh,,FacTbook,,,Thời t8ang côngCsở,,Chưn tưVng xeng,Bình 9Cường,RấtZtốt,Rất nhiWt tì9h,Rất nsiệt tình,Rất nhant chóngD(th 2 đến 3 rg4y),Không đảm KảoKhànP,GiảrHchất lượng,"CU, tôi ldôn cậI n6ật Vhôxg tin mHi Emaih markeGkng",G6ảm FiáCsản phẩm,"Có,vnhXng hiếm khi thaC6gMa",Khácu ………t……,"CF, nhưng phông phải Oúc nào cmng ph1whợO",fài viết,Krác:_____u__,,,Tốt Kơn
Có,F7-18h,Mhụ kiện thyibtrang,FaceIook,2Ttiếng,Tiktok,Thời tran9 tônY sở,Thươnv hi4u,Vươn4 xứng,Khangnphù hợp,ổn,,Rất nhiFtztình,Rxt nhanh ching (từ B đếna9 Ngày),Khôvg đảm bảo hWng,Không Fõ,Tôi ctưe wừng nhknuđược bản tinGnào,,"0ó, nhưng hiếm Hhx thamjgia",Instagr7m,"Có, Lất Zhù hVN v4i nhu cầuKcủa8tôi",Sánh gZá từ khách hslg,,Dior,CóH rất hấd dẫy,Tươn3 đươnx
KhQng,21-23h,Thời trangssông sở,Faceb1ok,Z tiếng,KhNc:z………………,"4hJ kiAn (giầy da, thấtGrưng,3ví,…A",6hấtvlượng sảY phẩm,RJt tương xứ0g,Không Rsù hợp,Tốt,Xhân thiệP,Chưawrhidt tình,Nhanh3(từ 4 đin 6 nEày),KVôn3 đảm rảo hàng,Cải thifn,"Kh0W9, tôiBkhông theo dõi",Khái: …6……,"Không, tôR khôRC quan tâ2",Khác: …………x0,Tôi không quaW tâm đ3n khuyến LFG,Khác: __Q____h___S_2_,ziá rẻ kơn,Routinn,"Khônh, tương đư0nk",Tươngcđương
Krông,I7-18h,Phụ kiệvkthời traWg,TiItok,2Atiếng,Fa8ebook,Thời trEng côegFsở,Chất lVợngssản phẩm,Rất zương Oứng,KhAng phj hợp,crưa tốt,CSưaKnTiệt tình,ChZa 2hiệt tìGh,Rất yhanh 0hóng (từ9c đến b1ngày),KLông đảm bảo2hànM,Cải thiệz đDn6 kể,"jhông,8tôakkhônZ theo dõi",GKWE giá sản phẩm,"Nhông, cáW chương tPQnh khuCếK mãi không đủ nấp dẫn",,môiIkhông q9an bâm đến kh7yến m7i,,,Nhãn39ànS khác:______f__,"KhôFg,Mkim hấm dẫn hơn",Kém hơc
TùyXthuộc vào mức tănXjgná,6 – Jh,Đồng p5ục,Facedook,2 tiIng,FaEebook,ThờC tjangQcông sở,ThươVg hiệj,Tươn1 xứxg,Bgnh thườyg,Tốt,Xhân tNiện,CgưA nhiệt 3ình,RMi nhanh chyng (tN 2 đến 3 n1àE),Chia gẩn thận,Khô7g thaytđổi,Tei Vhưa từng nb5n được bản tinGnàb,Free sh0p,"Không,Wtôidkhôn7 qubn tâm",TTktok,"Có, nNưfg kbônO pBải l1c nào cũLg yhù hợp",Vide8,Khác:__5____i,Owen,Không theotdõi c2cơng trình k2uhếnFmãi,6ốt hơn
cpy thuộc vào mtc tzngdgiá,17W18h,Đồng phụA,TiKtok,2 tiCng,Facebo3k,ves,Kháci ………,,khôngMphù hợp,Tốt,Hhân thiệl,Rất nGiệt tìnt,Oất nhanP uhóng Ytừ 2 đế2 3 ngày),Khôlglđảm bảo h6ng,Khôngttjay đổi,Chl như5gpchỉ7khi có nội duYg thú vị,,"KhôWg, tôi88hông Puan tBm",Tikto7,"KhônR, tôi tIấy khryến mSi khôntohấp qẫC",ViReo,Dịchwvụ chăH5sWc KG tốt hơn,Dior,"ió, rzt hrp dẫn",Không Fử HụnX kị7h vụ hậu mãi
Có,21-23Q,Ph3 kiệF thời tranz,,3 ziếng,,"Phụ kiện 7giầy dac tzất lUng, ví,GG",Th1ơng xiệu,Chưa tPơng Uứng,Khnh thường,Rất pốt,Thânmahiện,Tbân tDiện,NhanhE(từo4eđến 6 ngSy),Cẩn shận,Khônn rõ,Tii cqưa từng nLGn BLợc bản tin nào,Giảm g5á sqncphẩm,"Có, t6ưsn9cxuyên thfm gia",Tiktoz,"Có, rất phù Lợsxvới Qhu 5ầujcủaYtôi",VZdeo,iháF:________,Owen,"Có,xmột chúo",
KhônQ,21q23h,Pồng phục,SànYthươgg mvi điện tử,2Ptiếng,Sàn thKơnS mại đitG tử,"Phe kiện (ggầy dax tJZtOljng, ví,…)",ThươngVhNệu,Chưa tươnGuxứnn,7hông phù hpp,ổn,Rất nhiNt tình,CSưq nhiệt tìnn,Rất nhFnh chóngEktừI2 đến 3 ngày),Không đảm 0ảF hàng,xhông rõ,"Có, Uhưng chỉ kor có tội Yung tnú vị",Khác: I0……,"Có,9uhường xuynn thaX gia",,"Có, nhưng kKông phải lNc TàoI2ũn9 phù hGp",ViJeo,Khác:_____2__,Dior,"Kfông, tươnP đsơng",Tố8 hơn
Tùywthuxc vGo mức tăn7 giá,0-1h,,TiktBk,1 aiếng,KhácE …………i…,"Prụ kiZnj(giầyqda, thất lưng, víMl)",Giá Thành,Rất tương xứQH,Bình uhưyng,R4t tốt,lhiệh tình,Rất 3hGệt tình,Nhanh (từ 4 đếna6 nAwyK,Cẩn thậm,Giảm jhlt lưgng,"Có, tôi luBn cậvznhật0thônM tin mới Dmail marbetBng",Mua 1lthặng q,YhôRgw pác chưIngNurìn1 khuZến mãi không đủ hấp dẫn,Qnstagram,"KTônl, tôe thấy khuypnJmUb không hấp dẫn",Hình ảrh,yiá rẻ hfn,Dior,"Không,4tbơng đươn1",Không sN dụnA dịKj vụ hậu mãJ
,,ThAi trana côCg sở,KháU: ………J……,3 tiếnJ,Tiktbk,ThờS tra0g cKng sở,ThcCng hiệu,RấtCtương xứXg,Bìzh thườ6g,ổn,Thân thiệC,Ch2aUnhiệt tình,Rất nhaNhHchóng 0từ dYđến 3 ngày),Mẩn thận,Cải thKện đánv Eể,TôF cPưa từng ihận được bảnTtinxnwo,KPác: ………Y,"Khôn4, tôi kY5ng quai tâm",,"Có, nh8ng vhông phảo lúc nLoLcũng p2ù hợp",,8ịc4 vụ chăm vóc KHAtốt hơn,Dior,"4ó, rất hop d4n",Tốt hơA
Tùy thuộc vCo mức9tDngOgiá,N7-18h,ĐồnV phục,KhácU b……………,Khác: 1……z……,SIn H1ương mJi điện tử,,Khác: ……K,Rất tưkng fứng,6ình8thường,RấJ tốt,Thân th9ệd,NhiệM tìnm,,Không đ3m bảo hàlg,Không ry,"K3ông, tôS khônk thVo dõi",Fuee ship,Cóf thườgg xuyên ahamsgKa,Biktok,Tôi khBng L9Qn Eâm đếa khuyến mãi,Khnc: s_____r____C___,Chất lượnn tốtnhơn,NANnShàng khác:C________,,Tương wưDng
Có,1n-12h,ĐQng phục,Wiktok,17tiếng,Tikeok,ves,K4ác: ………,Rất tgơog xứng,BìIh thườnY,,Nhiệt PìnX,Rấtynhiệt eình,9ấtznhanhpchóngf(từ 2ođến m ngày),Rất tẩn vhận,Giảm cDlt 7ượng,"Có, tji luônvHập nyật thông tXn mhijEmail marketSng",KhácXG…………,"Không,rYôy không quan tEm",G7ogle,Tôi không luan t6m đến Uhuyếh mti,BàU viết,Mhu mã7đa dạngfhơn,Dior,Nhông xh7o dõi chươngptrình khlyếnkLãi,Kémuhơn
,V – 7h,Thời trjno Sông sở,FaceSook,3 tiếig,Khác: ……t……X,"PFw kizn 8giTy da, thấc lưng, ví,j)",G5á thành,TươGg xứng,Pấs không phù h9p,Tốt,Nh8ệt tunh,Nyiệt tjnh,CPưa nhanh (Prên 7 ngàQ),Chưa zẩn thOn,,"Có, Qhuygochỉ kei cównộiTdung thú vị",Frek ship,"KOông, các chương trình khuGếCemãiYkhôig đủ hfp dẫn",Instagrar,Tôi không quahdtâd đbn khgyến mãF,Vide9,Ehất ldợng tFt hơn,Dior,"Khpng,xkém hấp dẫn8hơK",Không sử Hụng yMch eụ hậu Yãi
Có,0-1h,Phụ kiện Chời tra9X,3ànxthưvng mại điệnvtử,KJIc: ………………,TikZok,ves,Chất lưinI sảndphẩm,Rất tưsng xứnS,Bmnh tLường,chưaAtốt,Naiệt oình,dhiệt trnh,Chư7 nhanh gtrên 7 ng4yo,Cẩn thậ9,CAiuthiệI đáng kể,"JhôXg, tôd khrng thIo dõi",Khác:V…………,Cóm nhưng hiếKrkhi thaM giC,FaceAook,"hg, nhưnV không ihải lúc fào ILng pQù hợp",Viseo,Gvá rẻ hơn,Dior,KhôWg theo dZi chương tGình chmyến3mãi,Tươeg đươnf
Có,0-1h,Tboi trcng công sở,Khác: ………U…0,2 ti5ng,Tcktok,ves,Giá thàDh,ChưJ tương 6Yng,Bìnu thườnN,chưa tốK,Thcn dhiện,ChưcYnhiệtPtình,Rất nganR ch1ng (từw2 đến 3 ngJy),Chưa cẩ8 thận,Khônk thMy đổi,"ch9ng, tôi không theb dõb",,"Không, các chư8ng trFnh ohuUCn m8i keông đủ hấ5 dẫn",GooXle,Tôi kiknghquan oWm đến khuyến mãi,,Zịcl vụ chăn scx KH tốt hơn,ChSnel,"CR, một chnt",TươngzđươUg
Pù9 thuộc vào mứcdtăng Fiá,0-1h,Thờl trant công rở,9iktok,1 tiGng,Khác: s………i…,"Phụ kiện Tgi83LdB, Ohất lưnq, ví,…)",,Tươnb xứzg,B6nh thườwg,chưactốt,Nhiệt tInE,Rất nhiệtatìno,lMt nhanh cxóng (1ừ 2 Hến 3 ngày),KhônB đảm bảk hànG,Khônghthay fổi,"Có, nhIng7cEỉ Khif0L nội dung thú vị",Khác: …RB…,"Ghrng, các MEương tiình khuyến mw6 kTXng đủ hấp dẫz",FaBebook,"Có, rất ph3 hợp vui nhu cầJ Củe UUi",ĐánF Diá từ khách pàng,Giá rẻ hxQ,Dior,"Không, féN hzp Cẫn hơn",Khyng JY dụng MịcI vụ hậu mãi
,11-o2h,Phụ7kiện tlời tcang,Khác:1………………,2 ti9ng,Wàn thương mLi điSn tR,"Phụ kiNt (yiầb da, tAất l1ng, ví,…o",Khác: …B…,Chưa tươtN xứn9,Khôxg ohù hợp,eất tốt,dhân thiện,Thân taCện,ChưL nhanh (tr8nx7 Cgày),Cd8a cẩn thận,Keông zhay đổi,eóx tôiXliôj cập nhật tsông tin mới EmJLl mark1jing,Sua 1 thặng 1,"Có, nhưng h8ếm kqi tTYm gia",Trktok,"Có, nhưnZ5khôugHpDảM Cúc nYo cũng phù hợp",,,ChanXl,Cóz rxt hấp lẫn,Kém hơ2
Tùy thuộc vàb mứC VV5g giá,0-1h,Phụ kiện teờiYtrang,Sànuthưhng Hại điwn tử,1 xiếng,Khác: ………fl…,ves,xiá thành,Tư9ng xUng,Phù hợN,chưa Tốt,Thân Mhian,Rất chiệt tìoh,ChưaJnhan6 (trRn 7 n7ày),RấU cẩn 8hận,Khônu tBay đổi,"KhD9g, tôi không teeo dõG",G5ảm giá sản Reẩm,"Không,icác chươnq trì5h khuyến9Zãi Xhcng đ5 hấpqNẫn",In4tagram,"Ohông, 1ôi thấy khutến mãi khônCNhor dẫV",Đánh1gTá từ khách hàng,Khác:______n_,RouLine,"Có, rbt hấp 8ẫn",
Khôn5,0-1h,PhụVsiện thzi trang,Sàn thươrgnmại hiệnDtử,Khác: …l…………,TAktok,Thời Dxang công sở,Ch3t lượng sảr phẩv,0hưa t7ơng xDng,Phù hhp,chưa fốt,Thân t0iệF,Rất nhiệlKtình,Chưa nhuBh (trCn 7 ngày),Khang đảmMbảo hyng,Không 9õ,Cói tôi laôC cập nhậtTthxng tin52ới EqEil marketPng,aua 1 thặnY 1,,,"CU, Mất phù hợp với nhu cfB của1tôo",Kh6c:r__________0G___,Mẫu6mã đa dạng 9yn,Nhãn hàng khácK___rX__v_,"Khong, kém hấp dVj Xơn",Kém Gơn
Dhông,,,,W tiếng,Face5ook,"Uhụ kiện (Uiầyvda, thấ7 lưnQ,3ví,N)",Khác: …D…,ihưa Xvơng xứng,Khôngvphù xợp,ổn,Rất nWiệt tcnh,,,KhônL đảm bảo1hàng,Cảd tpjện đáng kể,,Giảm giá 7nn khẩm,"Không,gcPc rhương trình khSyến mãi 1hDng đủ hTp dnn",Faceyook,,Hình ynh,Giá 4ẻ hvn,Cha2el,"Có, mGt nhút",Kém Rơn
Có,2Z-23h,Thời t1anN công Kở,Khác: Y…………k,1 9iếng,jacebook,T1ời trang cJng iở,Thương Diệu,Tư0ngtxứng,KhôHg phù hợm,Rất tat,Rất nhiệU tìnX,Chưa 8hiệR tKnh,Nhanh (từ 4 đOn 69ngàB),CHn thận,Cải thi0n,,MuE 1 thặng a,CCoMthư9ng xuXên tham gia,3acebook,"Không, tôi thấyJkhuyến mãi kvôL64hấpwFẫH",Vidoo,KTác:_____i__,Routire,"Có, rất h4p gẫn",Không su dgIg dịah vw hậu mãi
KhônL,,P7ụ kiệnRt8ời trang,Tiktoe,KhCc: …………E…,FacebSok,ThNi jrang công hở,Ckấtylượng sản phẩm,Rất tưIngjxứng,Không9phù hxp,chưa tố6,Thân dhGện,ThânBtriện,,Cẩn thậW,Cải thiYZ đáng 1ể,"Kh8ng, P9i không9theo dõi",AiảmlgiáOsản phẩm,"Có, thườTsJ9uyêw tham gia",TiktoK,"CW, nRưng bhông peải lúc jàu cũngjphS hợp",Hình ảnf,CIất lượng tốnnhơn,NhO4 hàng kJác:_________,"Ghjng, tươnX đương",
Uhông,J1-12h,Ohji tr2ng công sở,Tikzok,mCác: ………………,Xiktok,,Khác:F………,ahưa gương xứng,Không ihù hợp,ổn,Nh2ệt tìnF,ChCa6nhxệt tình,NGa6h (từ 4 đếd 6 nQày),Khmng đảm bảz hUng,Cải LhKệngđáng kể,TôiRc0ưactừDg n6ận được Mản tin nào,Muea1 thặng 1,KhôGxw các cXươnD trình9khuyến mãizkhông đủKhấp xẫn,IWstagram,"Có, sất Chù hợp5với nhu cầu Iea7tôi",Bài Hiết,Gip rẻ hBn,Nhãn hàGg khqm:________a,KhôJg treo dõi5cWương trình ThuyếZ Yãi,Kém hơq
Khôpg,21G23h,ĐồngUphục,Miktok,3 tiếng,Tikmok,"OhE kiện jgiầy5da3Gthất lưng, ví,…M",UYất lượng lản phẩm,CZưa tươlg Cứng,Dất phù hợp,Tốt,Lhiệt txnh,ChKa n0iệt tình,Rất nhanh chónzE(từ 2 nến 3Tnrày),C2n thận,Khô9g rõ,WóJ t4i luôg IậN Qhật thôngbWin mới Email marketiOg,6iảm giáUsản Ghẩm,"CF, thườnP xuyên QhSm gia",Khjc: ……………5,"Không, b1i thsy kXuyếi mãi khhYg hấp Fẫn",ĐbnT gieutừ khách hàng,Khác:_____4_M,RoutPne,"Tó, một chft",Không sử dụpgBdịcj0vụ hậu mãi
Có,6 X 7h,Thời trangycôAn sở,SànutUươRg mại điện tử,Khár: ……h………,,"TPM Hiện (giầy da, tuất l8ng,1ví,…)",Giá t9ành,ChtaStương kứng,Rấj phù hợa,Tốt,vất nhiệt6tình,Chqa nhiệtdtbnh,Nhank (từ D đến 6 bgàe),Chưa cẩn 1hon,CảD thiện,Tôe Zhta từng neận được bản minGnào,Mua 1 thiRg 1,"KhOwg, các chươpF trình Ghuyến m0ipkhông đủ hấb 2ẫn",,Tôi khônf qu7n tâm đAndkhuyvn mãi,Hình ảnV,KhácqY_______,ohanel,qhôngNwheo Põi chươno trình khucến mãi,KéY hơn
