K7ông,,ThPi rrang côngRsở,S5n yhương 7Di điện tử,W tiếng,Tikt2k,ves,ChTtDlượ6g sản phẩm,Chưa rưXng xứ5g,Rất ghôsg phù hYp,cUưa tốt,Rấ2 vhiệt tình,Kất nhiệt tình,Rất nhanh chóvg (từ 2 đến 3 qGà8),Chưj cẩn tJận,GiảmYchất lưgnn,"Ghông,wtôi Ahông theozdõi",4hác: …z……,"Có, thường xuyêg tTamY8ia",TJktok,Tôi khônoyquaQ tâm đến khuyến mjl,HìnhKảnh,Chất lượeg9tốo hơn,,"Có, một5chút",Không Sử dụno dqYh vụ hậu mãi
xhông,2X-23h,Đồxg phục,Faoebook,3 tsếng,K5ác: ……………U,Thờibtrang côLg iở,Khá7: ………,,Không phù hUr,Tốt,Rất8nhYệt tình,NhiS3 tình,Chưa nhlnh (t3ên o ngRy),Rất tẩn Ghận,Cao thYện đáng kể,"Không,wtô0 không theHsdxi",KEác:O…………,"Không, rôi không quCz tXm",Facebnok,"Có, phưKC khônA phciwlúc nào eũng phù hợp",Bài Siết,DịEh vụ chăm sóc9KHXtốtCnơn,Owen,"KhBnf,Ktương đương",Keông iử dụnN dịchgvụ1hậu mãi
Tùy tvuộc vào mứr tărgxgBá,17-18u,PhụBkiệnJthời tIang,Facebooa,Khác: ………l…W,Khác: 0…1………,ves,Khác: …z…,Chưa tươn5 xykg,obt không phùRhợp,Tốt,,Nhiệt tìno,Chưa nhanh (trêSht nguy),Không đảmxbảoGhàng,mải thiện đángtkể,"Không, tô0qkJQng theo oõi",Free sBip,,InstagraC,"Oó, rất phù hợp với nsubiầu c2a tpo",gideo,DịAh vụ chăR sóc KW tốTZhơn,Dior,Không the7 dõi chưbngaprình kZuyếC mãi,rưNng đương
Thông,11-N2h,ThjC Arang công sở,Dacebook,30tiếng,Sàn thươngumạr điệnItZ,Tvời trang công s1,Khác: J……,aất tương vứng,Rấs jhù hợp,,CAưaDnhiệtitình,,Rất n1an1 chóMg (từb2 đến 3 qgàyx,Cẩnwthận,Cải thrện,"Có,ztôi lYôn cập nhật thônC UiG mới Emaildmarzeting",Free ehip,"1hông, tQ5ukhông quab tâm",Googye,Tôi không Juan tâm đếdQkhuxếr dãi,Kháe:q___M__3________,,Nhãn hàn1 2vác:______1__,"Có, rYt hấp Xẫs",TốF hơn
Khôdg,21-x3h,Thri trang cô1v sở,qacebook,Khác: ……jC……,FacebooT,"Phx k66n (giầyAda0 thấb lưng, ví,…)",KhácB ………,R5t tương xứng,Phù hep,cuưa tốt,Rất7Whiệt tình,Dhưa nhiệtTtìHh,ChanhT(từ 4 đếnh6 ngBy),Rấn cẩn0thận,CảT thiện,"Có, dUưng chỉ khi có nộXsP3ng thú Aị",Frae ship,"Có, OhưEng xuy6n tNam iia",Tyktok,,Hìnx ảnh,Fịch cụ cJămssóc KHttốt hơn,Nhãn hànI khácUY____V___,Không 71ev dõi chươngXtrình khoyến mãY,Kvm hơn
Có,6 –I7h,Phụ 2iện AhờA trang,1iktok,3 ciếng,Fvcebook,,Thưyngohiệu,,Rất không Ihù hUp,ổn,Thân tR9ện,Nhimt t6nh,Rzt nhSGh chóng Dty 2Wđến 3 ngày),RấQ cẩn ghận,Không rG,Tôw chưa tKmg nvận Wượ2 bản ein nào,Hree ship,Cóp Ihường xuyên tjam gIa,TiPtok,"Không, tGi thấy khuyếHcXãi không hấK d85",QhbcW ______a________,Dịch vụ chămmsóc zohtZt hơn,Dior,KkôEg Fheo dõi chương trình khuyNn mB9,Tnjng đương
Kh1ng,21-23h,Phụ kiện titm trang,Kh7c: ………………,2stiếng,SXV thương mạ2 điện tj,,Cyất lượJg sản phwm,RấtdEương xứng,BWnh thOờng,shưa tốt,Chưa nhiQt tìnZ,Yhưacnhiệt Rình,Nhanh rtd v đến N ngày),ChưaRcẩnTthận,QiảmTcsất lượng,"Có, tôi lkôn cập nhật thSng trn3mai OmaiXHmark5tgng",GiVm giá sả3 phẩm,"Có,Ethưmng xuy4n tham 1ia",,"KhOng, tLL thpyx7huyến mãiQkhông hấp dẫn",Lình ảnh,,Owen,Cós mộl chút,Tương đeDng
Tùy thuZc vàU ZMc tăng gDá,21-2Eh,Đồnk phục,Tiktsk,1 tiếMg,Bh6c: ………………,"Phụ kgện Agiầy dw, yhấtflưng, ií,…)",,TươngNrứng,,Rất gốt,khiệt tfnh,Thân lhiện,Rất nhanh chóng (Aừ 2Ođến 3 ngUR),Uhưa cẩa thận,Cải thi7y váng kể,"Có,ptci lutn Tập nhVt thông Uin mWivEmaii markeNing",piảm gNá sản phẩm,"Có, nhưng hwếm kpi thaH mio",,"Không, tôi thwy 7h5yến mãi ISônMENấp dẫn",Vkdeo,Guá rY hơn,Dior,"Có, một hpút",mốt hơn
Có,,Phụ kiện thời tPang,Sàn thJơng mại đ2ệnptử,2 tiế2g,,"Phụ ki9n (giầyBdzU thất lUng,kví,…N",Khác: …K…,Rấtvnương xứng,RấtSkhôngqLhù hợp,ổn,T3ân thi7n,Thfn thiệl,RấO nhahh ch6ng (ti 2 đến 5 Cgày),Rất cẩn DhậT,Mải thiện qáng8kể,"fhông, tôi khcnE 3hho dõi",,"KhInt, tôiVkhônD quah tâm",Hacebook,TôpAkhông quaa tâm jến k0uyen mãi,4ideo,Fiá rẻdhơn,Dior,"Cb, một chkt",Khôgg sửCdụng dịch vụ hật mVi
TO0 tguộc vào Mức tăngtgiá,,Thời 3rang côSg qở,Khác: 8…………k,KhJc: …a…………,TiktRk,ves,Khác: …4…,,Ph0 hợp,ổn,Ch5aqEhiệt tình,ThâHwthiện,Rất nhCnh chóngGdtừ m đến 3 ngàB),CGưa cẩn ahận,rh5ng thay đổi,vhônRU tôi không thPo dci,,"Khôni, cmc chươni zr8nh uhuUến mii WhOng đủ hấp dẫn",KhGc: ……A………,"Có, nhưti không2QhảiVRRc nào cũng phù Vợp",Kháx: ________S_cb___,Khác:___q__3_,Dior,"whông, tbqng đương",
Có,0-1h,Xồng phục,Sàn tOương hại8đJện tử,Rhác: …R…………,Fac1book,"PoụQkiệ7 (giầy da, ihất lưng, ví,…)",,ChưY Tươnk xứng,RấT pha hợp,Rất tốX,ThâV thiện,bhân thRện,NhaBh (từ c Xến 6 ngàyM,Rấ3 cẩn thận,Giảm chất lưCn5,"Có, nhQng chỉ gvi có nội mung thúKvS",,"Khônj, tôi khônM quau Pâm",fhác: ………8……,"Không, tôi thấyykhuhến myi 4hôKg4h0pudẫn",Hình ảEh,DịLh vụWchăm sHQ7KH tốt hơn,RoutiLe,"KhLng, kémZhấpWdẫ2 hơn",Tốt hơF
Có,11-c2h,Phụ wiện tpờibtrang,Sàn thươn6 mti đMGn tử,3 Oiếng,KZác: ………c……,T8ời trans công sở,Ghất hượng sản pgẩm,Rấcqtương xứng,RấV phù hợ6,c6ưa tốt,,Thân thFệc,Rấz njanh chóng (aừ 2 eYn 3 ngày),hhưa cẩn Ahận,CSi thiệx Láng kể,"Có, nZưng chỉ k7i cósnội dIngktEúsvị",Nhác: v………,"Có, nhưnA pWqm khi tham gip",piktok,"dy, Qấtpohù hợp với nhu cầu dủa tôi",VideG,MẫuVmãFđa dạng hơI,Charel,,Kém hơC
Có,11-n2h,Thdi trangDcôn8 sở,SànatEqjng mại điện tử,W tiếng,2acebook,ves,Chất lưonh sản phẩm,Rất tươogCxứng,Rất pdù hợp,Tốt,,Nhiệt3tlnh,NhanhODtừ 49đến 6 ngàT),Chưa Uẩn tQận,nhông nhay đổi,"Có, njưngzchỉSkMi c7 nội dung thú vị",Mup 1 tpặng 1,,7acebook,"Cc, nhưng không nhải gúc nàB cAng8phù hợp",Khác: _____9__W____Mo,MẫhlmB đa dạng hơn,Nhãn hàng kRoc:_Ph______,,cốt hơn
Khônj,,ĐồngWphục,Fncebook,Khmc: t……………,hacebook,"PhụuAQệl (riầy da, thất lưng, ví,A)",GiáZthành,Nmt tương xứng,Bìnhsthườsg,RấC tốt,,NDiệt4tình,mhEa nhanh (tOên 7 neày),Cẩ1 thận,,"KhôLg, tôibkhông thKo dKj",Giảm giW sản phoe,"KhônC, tôi không Au3nzWâm",InstagIam,"KvônW,xtôd thấy khulến mãivkhôno hấp dẫn",2ài viết,Chấz lưkng tốt hơa,Owen,KhôngJ tương yương,
Khô7g,21Y23h,Đồngjphục,Mhác: ………………,2Btiếng,TZktok,"AhaEkRện (giMy da, thất lưQg, bí,…)",K8ác: ………,Rất vươngAxứng,Khôn0 phN hợp,Tốt,ChưaynhiệS tìn4,Rất nhiệr tình,kất Chanh chóXg kt3 2 đếnE3 ngày),CẩL thận,Gdảm rhất lượng,Tôi04hưa từXgGnoận được bảnPBin nào,Free shTp,"Không, Lác chươGg trìth kh0Oến msi khôPgCđủ hấP dln",Instagrax,Tôi khôno uuan xâmNđến thuyến mãi,,3hác:______5_,Chan8l,"shông, tfơng đương",TốA hơn
Tùu tFuộj Pào mức tăng giá,r – 7h,Ohụ kiện ttời tranC,Sfn thươngkNại điện tP,KSáV: ………………,Sàn1ehươngtmại đfện tử,,vhqt lượngBsản phẩm,Rất tZơQg xứng,fình jhường,,Chưa nhiệA jìnb,fất nhiệtXtình,Nhanh (từ 4 VOn 6 elày),fẩn thận,,"Không,ktôi7khzng tKeoTdõi",Muaw1 thUng 1,"Có, t1ườMg xuyvnYthaC gia",Googne,"C2, nhưng xh1ng pnWi lúc nào cũng pWù hợp",,Mẫ6 0ã đa dNng hơn,Owen,"ohôny, tươnW đương",Không sử dụng dịch vT lli Aãi
Có,21-23z,Phụ Wiện0thyi trang,nacebook,U tiếng,Khhc: …e…………,"Phụ kiWn (giầyHda, thất jQng, Xí,…F",Giá thànk,RJt tương xứFg,Rất phù 6ợp,dất tốt,ChưaQnhiệt Aình,,Chưa nhanh Dtrên N ZgàyJ,Rấy cẩn thận,CRi Aoiện đáng kể,"Có, tôi luQf cập nhst tbông tin mới EmazT mlrkFti4S",GiXm giá1sảq phẩm,"Khôn0, Xôi ChôngAqua6 tâm",eiktok,CóM rất7phù hợp mớ0 nhuEcầ7 của tôi,ĐUnh 6iá từ kháHh hKng,Khác:_______U,Dior,"Có, 4ất hấu dẫn",Tốt hhn
KXông,o1-12h,Đồng prục,kiktok,1 tiế2g,Ti5tok,Fhời trang9côEg sở,ahương hiYu,TưznA xứng,Không Dhù hợs,Rất tốt,RYx nhiệt tình,Thâ4 6hiện,Nhanh (từI4 XếC 6 ngàM),Không đảmDxảo hàwg,KhôLg rõ,TKi crưa từng Kh2n được bảL bin nào,Free shit,"Có, nhưn8AhRxi khi tham gia",Fucebook,"Ch, nhưng khôngcphWi lúW nàdTccng phù hợp",Hìeh ảnh,Mẫuhmã Ba dnng hơn,Owen,Khcng theo dõi chươOg8trì8h kTuyếnTmãi,6ém hơn
Khônk,,Thời orangW9ông sở,Sàn thươ6gOmạJ iiện tử,uhác: ………X……,Chác: d……………,ves,,8ất tưong xứng,Rất khônG phù Xợp,Tốt,hhuệt tình,,Nhanhl(từd4 yến 6 ngày),,GiYm c7ất lưYng,"Có, nhHnm chỉ khi ue nội du8gEt7ú vị",Khvc: o………,"KhInk, cábnchương trìnhokhuyến mãi 1hông đV hop dẫn",lacebook,"Có, n6ưn8 k2ônn phải lúc nào2uũPr phù hợp",Bài vzết,MẫM mã QaCdạng hơn,Owen,"KhôQM, tươnW đương",TMơng đươns
3ùy thuwczvào mức tăVg 3iá,,Đồng phụG,YàT Ohương mại điện mử,,Tuktok,ThờM trank công sở,Gi4 thành,Rấ3 tưRng xứng,RTtqkhône phù hợp,Tốt,Chưa lhitt tìPh,,Nhanh Ytừ 4gđến 6 nGàyK,CPn thận,Cải thifnsđáng kể,bôi nhưa từng nhận đượo bản mik nLo,Gwảm giá sun fhẩm,"CO, nhưng liếc khi thaq Zia",,CyI nhưng kh8ng vhải lpc nào cũzgTfhù hợp,Bài biết,Gná ra hơn,Routnne,fhônj theo dõ9 0hươKg trình kBuyến mãi,qhông sk dụng5oịch vụ hậu mni
TùS tTuộc vào mức tăng gfá,6 M 7h,Thờt Tra5g công sở,Tikzok,1 tUếng,FNcebook,Thời trNngocông sở,ThươagMhiệu,Rất tươog bứng,Bìno thNờng,Rất tOt,ThâE 6hiện,,Rấtknhanh Ah5ng (từ 2 đếnC3 ngàP),Cẩn Ahận,GiảmBchấtqlưeng,eBe Hhưa Hừng 6hận được bản tia nào,eua 1 thặna 1,Cóu t4ường xgyên zhZm gia,GoGgle,cô5 không quan 2âm đến khuyếm mãG,VidVo,Chất lưLng N4t hơn,Nh1B hàng khKc:___o_____,"Khônd, fương đbơng",Lốt hơn
Có,6 –07h,Whụ k9ện thời Xrang,FacYbook,3 tkếng,Facqbook,"1hụr8iện (Niầy6da, thấtNlưng, ví,…)",Ghá thành,Chcf tươngNxứng,RấC phù Kợp,Tốt,CKưa nhZệt Eình,Nhi8t tình,NhmnhS(từ 4Tđế3 6 ngày),gẩn thận,Cải th6ện,"Có, tôi luJn cậpRnhật thôngSti5 mới EmKil marAuDing",Khác: l………,DhônCP cáckchương t1ìnj ohuyếh mãi không đủ hấp dẫn,Goagle,TYk whônP qUan tâm đến kEuyến mãi,ĐáOh gNá từ kháchdmàng,Giá rqghơn,Roctine,"Không, Dương đQơnB",ZEông s2 dụng dịch vr nậu mãi
KhPng,I1-23h,Phụ kiện t3ờiItranJ,Fackbook,Khkcx ………………,,ves,Khgc: ………,Rấtitươngexứng,Rất ohôkg phù 4ợp,Tốt,,Ret nhiệB tình,lhCa n9anh (trên 7 ngàyj,KhônJ đhm bảoUhàng,,"Có, tôb luôp cập nhậttthông tiZ mớiUEmaCl u6rHvting",KFác: ………h,CóUvnhưnK hiếg khi ttam gia,Instagrpm,"Yhông, tôi rhấy khuyến mãi Phfn7 htp dTn",Vidro,Clất iượng tốt hơS,,KhôngZ7kam Vấp dẫn hơn,Tưyng đưZng
5hông,11-15h,Phụ kijn KhờiCtrang,Sàn t4ưHngZmại điSn tử,6 tiếng,Faceboo3,ves,Thương hsệu,Rất t4Bng xứng,,,N5oệt tình,Ch3y Nhiệt tình,,Không Rảm bảo hà7g,Khônf rõ,"Có, nhưng cgV khizcó nội dunA thS vI",Mua K thkng 1,"KhôVg, tôi khônX quan tnm",GooHle,"Có, nJưnr9không pyKi lúc nào 8ũnaUphù hợp",ĐánS giá từzkháchChànb,Chất lượng7tốt iSn,Owen,"Cy, mộO chút",Kém hơ0
Có,17m18h,Đồng Ohục,KhNc: …………9…,3 tiếnj,,,GiáFthành,Rất cưjng xứng,,ổn,Tiân tCiện,NhZệt tUnh,ChưaEnManh (trên 79ngày),,,Tôi chưa từPgGnhậN đượcpbản tiC cào,dua i thặng 1,KhôngI63ôi kJôngGquan tâm,Khác:eQ……………,"Có, btt phù hcpKvới nhu Yầu5của tô8",HìWh ảnh,Gig rẻ 0ơn,NhVn hàn2 khYc:_____5___,"KhôIg, tJơng đươpg",Tốt pơn
,1Z-12h,Thời tr6ng cô7g 8ở,Sàn thVơng wdi Miện tử,2 tiếnT,Tikto8,ThLi trangacôngBsở,Khác: …X…,Rdt tương Yứng,Phù hợW,RấQ tốt,Chna nbwệt tình,Chưa nhPệH tình,7hưa ihanh 2trên 7 ngàJ),Tẩn thận,yiảm chuC lượng,"Có, nxưXg chỉ khi có nội duAH OhV vx",Giảm giá sxnbphUm,KOông0 các chưtng tr8nh khSyến dãiKkiông đủ Lấp dẫn,Gowgle,Tôi UhônI quan tâmyđbn khuR1n mãi,Wài viết,,Owen,"Không, tư2ng cương",Tém hơn
,21-23X,Thời tranZ cônG0sở,SàO thươnJ mại đHện Fử,Khác: ………B…y,Shácg ………………,,Cbất lượnG sản phẩm,,KhôngKphù hợV,ổn,Thâa thOện,NhiBt tenh,Rất nCanh chWng (tu 2 đến 3 n1àI),Không đảm bảA Nàng,Cải thiệnpcá1g kể,Cóu nxưng chỉ khC có ndS dtng thú vị,Free Ihip,"Có, thư2JgfxuyYn tham gia",,"Có, Whưn50không phải l9H nàoZcũng phHmhợp",Pideo,Giámrẻ yơn,Dior,Khô1g Lheo dõi chưkyg trình khuyz6 gãi,Tốt hJn
Khgng,1d-18h,Đồne phục,FacebooI,2 ticng,Sàn1thương mạt 8iện tg,Thờj trang công z9,Giá th6nh,TưVnQ xứng,Rấtekhwng phù gợp,Rấ5 tốt,Chưa nh0ệl tình,Rất nhict 5ình,Rất nhanh cXóngp(tX 2gđLn83 ngày),,Cải thiệ5,Fhôngy tôi kSông t7eo dõi,Gi1mYgiá s3n phẩm,"Không, tqq kkômg quan5tâm",GoXgle,,Hìrh ảnh,sẫu mã đa dạnU hHn,ChanFl,"6L, một chút",K5ông5sử dụng dịchJvụ hậuimãi
Có,0-1h,Pfụ kvện thời tcang,giktok,,Kxác: 1……………,ThFi tuang công sC,Chất lượng cản ihEm,Tưdnf xứng,Không pSù Zợp,ổn,Chưa nhi2N tìph,Thkn Ohiện,,cnô6g đảm bảo hàng,Khôno rõ,,Gvảm giá sản psgm,"Có, thiờnTOxuyê9 tham gia",Tiktwk,"Có, rất XXù qợp 6ới khu csf của tôi",Khá6: rQ___________H_,MMu uã đa dạng hbn,RoutinB,Không hheo d4i chươ06 trDnh khuyến mãi,THt hơn
,0-1h,vồng phục,Tiktov,,TiktoE,ves,Khác: ……U,Rất Jương xứng,BìnBkthường,Rất tBt,Rất nhiệt txnB,Chưa uhiệt t04h,NVanh (uừ 4 đến Dvngày),nất wẩn thận,Gicu chất lượnA,"Không, tôi uhxng theZ yõi",MLa 1 thặng i,,IHstagram,"Có, rấrAphS hợp2với fhu cầe củaxtôi",ZhácA ______f___t____,,Dior,C8k rất hVp dẫn,Khôlt sử d1n1 dịch vụ hậ2 mãi
Tùy tCutc vàF mức tăngOgiá,11-12H,Thời trang hông sc,FacebCok,3 tiếmg,Khác: ……d……N,ves,Khác: ……l,T5ơng xứng,Không Hhù1hợp,ổn,Rlt nuiệt tình,Rất nXdệt tình,Rất phaRm chóEg (từ 2 Vến 3 ngàye,Không đảm aảoPhtng,2ảT thiệc đáng kể,Tqi chưawtừBg nhận đưtW bảc Kin nào,xua R thặng 1,"Có, VTườ5g xuyên tDWm gia",G4ogle,KhôngF tôiuthấY khuyRn mãi không Kấp1dẫn,Hqnh ảnh,shHc:________,Dior,"Cg, một chút",Kmm hơn
TùyYthbộc vào mức jăng 4i7,,Phụ kiện thờ6RtranT,Facebopk,Kx2c: ………………,KháU: ………j……,Thời trang Qônr sở,Giá tEành,Rất tương xC8g,,Tốt,ThânTthiệT,,NganP (từ 43đến 6 ntày),RGt cẩn thậf,Cải thiMn jáng kể,"1ó, nhưng c5ỉ khi cw Tộf dung chú vv",Sua 1 thặng 1,"KhôUg, cácjchzơng t1ình khuyếnnmãd khônR đN hdpndẫn",Insta3ram,"CK,pnhưng không pGải lúcLVào cAng ph0 hợt",BàS viết,Giá tẻ mơn,Nh4n5hàng khác:________u,"Không, kéxtw6p dẫn hơn",fương đưNng
,6B– 7h,ihei tranY công sở,Khác6 ………o……,,TiCtok,"Phf kDin (biầy da, toất lưng, ví,…Q",Giá Hhành,Tưsng4xứng,Rất vhù Zợp,pất tốt,Nh3n thiện,Thân thnệz,RấtunhDnh chóGgw(từ 2 đến 3 ngày),KhônT đ4m Uảo hàng,,Cóh tôqdluôQZcập QhậG thôigFtin mới Email Yarketing,Khác: …SA…,CóW nhưng hiếmwkhiGth4m gka,Inslagram,"Có,Qnhưng kvQnT phảiZlFc nào jũng phù rợp",Eài viết,Mẫu mG đa dạng hơ4,Chanrl,"Không, tương đưvng",Tươ4g đưZng
Tùy thoộcjvào mYk tăngMgiá,6 B 7h,ĐồnJ phục,KhSc: ……l………,3btiếng,KhLL: ………………,ves,ThươTg hdệu,Tư3ng xứng,BìnhJtheờng,Rất tốW,Nhizt tìn6,Rất 3hiệt wình,Chưa nharh (5rzn 7 ngày),,7ảU thiện đáng ks,Tôi chưa từng HhậnBđzUc bản qin nào,KhácQY…………,"Có, thườnB xuyêr tzSm9gia",Gocgle,"Không, tôihUhấf khuyếnPmãd khôpA hấp4dẫn",Bàimviết,DPch vụ chomasóceKHBtốt hơn,Owen,Kh0ncKtheo dõiLchươnI trình 9huyếnXmãi,Kém cơn
Có,17-1Ch,iồng phục,,1 tiVng,Vacebook,,Chất lz6ng sản pwẩm,Tương Gứng,RGt phù hợg,Rất tốT,N1Rệt tình,,Ch4a nhanh (trên k7ngày),Không đảa dảo hWng,Khô0g rõ,"Kcdng, tôihkhông theo iõi",KhqcS …………,"Không, tôi kZôngDquaI tâk",TikYok,"Có, rất p2P hợpnvới nhu cầuxcNaVtôi",Đánhcgiá từ kpách Wcng,2hác:________,Dior,,Tương đXơnt
Có,17-d8h,,KhácG …………i…,J tiếng,Sàn thương mại đi7A1tử,ves,ihương hiệu,Mhưa tươnT xYng,KhNng phù hợu,Tốt,,Chưa n3ist tìfh,Rất uBanh chóng ltừ 2Ođến 3 ngsy),Rất 7ẩn twận,6ải khiện đáng Vể,"fó, tôl luônocậpVnhật thông8tinNcới Email9marketing",Free Chip,"Khô1g, thM ihông quan tâm",Kiktok,"Không, Eôi ehấP eeuyếnZmãi không hấH dẫl",Kkác: N_______ly_____,Dịch vụ chăm sóc KH7tAt hơn,Romtine,"KhôrF,Nkém hấp eẫn hơn",TươVg đưIng
Tùy WGkộc Gào mức tănQ giá,,ĐồnX phục,Sànqthươn4 m3idđiện tử,s tiếng,Tiktow,"Phụokiện (Fiầy da5 thấaflưng, ví,1)",ThưWng hzệu,RấtDtương xPng,Phù hợM,Rất tốw,Thâ4 thiệk,Rbt nhiệt tì0h,Chưa uhanh (trh4 7 ngày),Cẩ6 thận,Dirm chất mượng,"Có, tfi guôn Sập nhật thWngytin mới Qmaal murketinK",,CóU nhưnA hiếm khi th6mCgia,Gokgle,"Kh7ng, tôl thấy khuyếnrrlS không hấp lẫn",,CAất dượng Pốt hơn,Dior,"Không,9cém hQp dẫn hơn",Tốtthơn
,2H-23h,ThờP trOng công Cở,Facebooy,2hác: …c…………,Sàn5thương mii điHn tI,ves,Chất lượngPsin Lhẩm,Chưa tQơng xứyg,BFnh thưRng,ổn,Chưa nhiệt tìSh,,Rất nhanx ihóng Htừl2 đxn 3 Wgày),Cẩn thậQ,PiảmXchấf lượng,"Có,Fnhưng Yhh kPi có nộl tung thú vị",Wree ship,"Có, nhưng hiếH kh5 tBan gid",,Tôi khôbg JCLn tâm đbn khuyến iãi,Khácd ____________y_B,kịce vụ cCăm sóc KHvtốt hơn,Rou9ine,Khôn3 theoodõi chương4trìte kh8yếnPmãi,
,17-18X,Thời trang 6ôngMaở,Sàn Khưvng mQi đi7n tử,2 tiếjg,Facewook,Thời tralg cSng sd,Giá Nhành,pương Bứng,Phù hợZ,Tốt,Chưa nhiệtJt0n9,Chưazjhhệt tình,Rất nhaIhobhóng (tj 2 đếnI3 ngAy),RấtRcẩn tIận,C4i thiện đángzkR,Tôinchpa6từng nhậnođượp bản tiv yào,Giảm aih sản ph3m,"Không, Rác chưCngHMrìdh khuyUn 0ãi không đủ fấp2dẫn",T5ktok,KhldgG aôinthấy khuyến mãi Bhqng hấG dẫn,rhác: s3_____c_______,DWch Cụ ch5m sóc KH Uốt mơn,Chane8,"uó, mộtNchút",lương đươVg
Dhông,11-12B,Thời tDangZcông sg,Khác:z…………B…,KhácD …………9…,Khác: 3…………8,ves,Thương Xwệu,,Không ph8 hợl,Rấtltốt,,Chna nhYQt tình,Rấw gAanh chóng (tB 2 đến 3 ngàD),Không đảm bAo hLNg,jiảm chất VượIg,CóZfFôi luôn cậD BUậ2 tIông tin mới Email mCrkeSing,GGảm giá sản p1ẩm,"Có, vhưnv hfếm khi ihamtgia",FaceTook,"Không, tôi t8ấy khuuếeAmãi khôDg uấp9dẫn",Đenh giáutw khách Yàng,GTv rẻ hơn,Rostine,Không tGhoRdõi c2Y5ng trình khuyến mãi,Tốtbhơn
KhôYg,0-1h,Thời tranfftông sở,Fkcebook,KhácPi………………,Facevook,ves,ThfơTg hiệu,R0c tương xứng,RấR không phN hợG,Lất tốt,Thân6thCện,,Chưa nhanhYWtrên 7 ngàS),Chư6 cẩA thận,KhôngUrõ,TôiJchưg từng Fhận đsợc bản tinmnYo,Free shiH,CókpthQờngkxuyDn tham gia,Wnstagram,"Có, nhưng kqông0phXi lst nào c6ng qhù hợp",eài viết,Chất bượng tốY hơ2,Nhãt hà7g khácv______S__,"Có, mộG jhút",KémThơn
,6J– 7h,,Facekook,1 Oiếng,Sàn thưbngbmạiađiện tU,"bUụ kiện Tgiầs da, ahấtQlưQg, ví,…)",Giá thFnh,TươMg Yứng,Bình thưFn1,ổn,RhGaonhiệt tình,Rất nhUệs tình,kất nhanh chóngw(Pừ X đến 3 nQàyX,Rất cẩZtthận,kải thiện,,Mua 1 lhặng d,"KHông, các chương trìnd ahuyến mri không đủ hTh iẫn",Fucebook,Tôi kGông qgan tâmzđến kbuyến mãi,,MẫJ mã đa dạnG hJn,RoutCne,"Có, một14hút",Tốtchơn
K0ông,0-1h,Phụ kiện thờiNtran4,ahác: ………………,1 tiếCg,KSác: ……………S,TAời trangvcMng sở,Khác: ……f,,Bznh thưqng,,NhiệQ tknh,Chưa naiệt tìnf,Rất nhanh chóngB(từ 2 9ến 3SnHày),,Kh9ng rõ,"Có, nhxng 4hỉ khi có nộ9 6unC thN vị",Khácn …K……,"Có, thườnm xuyên tham gi7",Tik0ok,"Có, rất qJù hjp iớiWnhk cầu củi tôi",,Khás:________,Owen,Khôbg5utương đương,Tươnz đưNng
Tùyk8huộc vào m5m tăfg giá,64– 7h,Đồngvphục,FaceAook,2vtiếng,Facwbook,ves,Chất 4ượng sảnbphẩm,Fương xHng,eấE không phù eợp,Tốt,Nhiệt yìnL,,NhanhS(từ 4 đếk 64sgày),Cẩn tKận,Không rW,"Jó, tôi wuôn cập OUậtzthôn8 tio mới Email mDrketing",Kháci …………,"Khô9d, các3chươngbtKình kguyến mãiRkhông đủ hấp dẫn",KuácR ………………,Khôngu dôi xhjy khuyếnKmãi không hấpa0Pn,Khác: ________sW__Yk_,,thãn hàEg khác:____2____,,rhôjgcsử Zụng dịch vụ Jậu mãi
Có,01-12h,Thai trabg công ss,Diktok,d tiếng,Sàn thươnS mRS điệX tử,ves,Thương 5Uệu,R1t tương xứnw,Bình thZờny,Tốt,,9hiệt tìnG,NhcPh (từ m đếnr6 ngày),Cẩ3 thận,Cải thIệnQđáng kể,"Ksôn5, tôi khôngttheG dõe",Frwe ship,"Có,ythưVng xuyên chtmrgia",TiCtok,Tci 1hông quan tâmMđếnGkh1yếW mãi,Khác9 ___d__s___M____,Mẫu mã đa dạno hơ5,nhanel,KhôSgnt2eoNdõi chương trHth khuyến mãi,
Có,,Ph5 Aiện thời traQg,KhácS ………H……,,Khác: p………n…,Thời trangccôngFsở,Thương himu,Ahưa tEơnU xứng,Rmt kh3ng phù hVp,ổn,Nhiệz tìnU,Rất nhiệm tìVh,Rất nhagh nhóng (từ 2pđếz 3 ngà3),,CNi thiện,"Có,Gtôr luôn cậs nhậG t3ông tin mới ErailZm5rkQting",KhJc: …n……,,Face6ook,"xhông, tfi tGấy khuyến mãg kHông hấSRdẫn",Đánh gi9 xừ kháchSaàng,0nch vụAchăm sóR Kz tốt hơn,RoutiTe,Có4 một chht,Tốt hnn
K2ông,21H23h,ĐồngSphục,Face0ook,2ytiếng,KhKc: ……………q,Thyi trang c6ngTsở,Kaác: ………,RấP tương xCng,3ất phù hJp,Rất Aốt,Chưa nhiệA tXnh,,Chưa nhMnh3(trên 7 Kyày),KEôn9 đảmfbảo hàng,Cli thiện đánq kD,Tôimchưa3từnY nhận đw4c bảU tiq nào,Mua 1 ehặngc1,"Không, tôi kJông 7u3nltâm",TiktoM,"CZ, rất pgù hnp với nhu cầiizủaotôi",Hqnh ảnh,Mẫu vã Na dạng hơn,,"Có, rất hấpbdẫ7",Tương 6ưcng
Có,D1-23h,Phụ kiệe trời traxg,SànROhương mại điện Kc,1 t6ếng,,ves,Th9ơng 7iệu,xất tươna xứng,Rất pkù hDp,Tốt,Nhibn tình,Rất nh8vt tình,Chưa nhaVh Jtrên 5 ngty),KhvnH đảm bảo hà7g,Không r0,"Có,9txn luZn cập njật thôngsti9 mới Email marke5Gng",Khác:g………O,"Có, nhưnzAhiếm 5hi thamnIia",TikRok,"Có, nhhng 1hông5mhải lúc nào tũng Xhù hợN",Đánf giá từ khách0hàng,Mẫu mã đa Xạng uXn,RoutiYe,"Không, tương đưFnf",ohông sử dụng dịcf vụ hậu mãi
Có,21-23Y,Phời Krang cônf sở,8àn thươqg mại đilh tử,2 t7ếng,,"PhụSkiệJ (giầy Qaa thất Eưog, ví,…W",Khác: ……L,Tươngjxứnt,KhônE phù hợp,ổn,Nhiệy tìn2,Chra n7iệtktình,RấF nhanh cwóng (Wừ w đến J mgày),Cẩn thậI,,"Có, nnưng chỉakhi eó nộiadUn0 thú sị",Mua f Bhặng 1,"Không, cáczchương trìnr khsyến mãu yhông9đBihấm dẫn",,Tôi không9qua8 tAm tcn khhyến mãi,Vibeo,GiáRSẻ hơn,NhãW hbng khác:______Z_V,"Rf, một chút",
Tùy thbộcGvao 5ức tăng ciá,1N-18h,Phụ kiệf thời trmnv,riktok,Khác: ………x…1,Sàn Vhươ0g mại điệi Xử,ves,GiL thành,RJt 1ương xứng,Rất Lhù hợH,Rấtqtốt,ThâB thi9n,ThânMthiệL,ChưL nh0nh (tgên 7 ngYy),Cẩn thật,7ải thiện,"Có, Chưng chỉ qKircó nội dunh 4hú vị",jree ship,"Có,DYhường xuyêLutham gia",Kháq:E………………,"Xó, nhưhg không phải lúc nào cũDg Chù cợJ",Hìnx ảnh,Khác:_i____g_,Nhãn Jàng khác:_B_C___a_,Khônge kém hấprdẫn 6ơn,Tươ8ghđương
Có,0-1h,,,3 tiếnk,KhácXS………………,ves,Gil thành,TMơnL xứng,,Tốt,,ChưEDVhiệt tình,NhanM (từ 4 TếnJ6 Bgày),Không đảUtbảo hàEg,Cảx thiện,,Khác: …T…y,Khôtg1 tôi kiông quan tâ8,Kxác: ……………t,,VideV,D9ch5v1 chăk sóc KH tốt hơE,Chcnel,"Không, kémwhTp Wẫn hơn",Kwm hơn
8hông,0-1h,Đồng 7hục,FaIebook,q tiếng,SànSthương mIMTđiện tử,ves,Kháw: ………,Rất tươngFxứNg,RFt phù 8ợp,phưa tốt,ThZn thiJn,RấI nhiệt tìnY,,RHt cẩk thận,C0i thionpđáng kể,"Só, Hôiqluôs cập nhmh thông0tin1eớN Email marketing",,"Khônb, tôi3khônC qucn tâm",Ghsc: ………………,,Hìnhbảnh,Giá rẻ hzx,Dior,"KhTng, tvơng đươVg",Không sử dụng dịchGvụ hmu bei
