5hông,17-18t,Phw kiệm tzời trang,Sànuthưrng Cii điện tử,1ztiếng,Tik7ok,"PhV kgệN (gzầy da, twất lưngA ví,…U",Khác: …E…,CLưagtương xứng,,Tốt,ChưjCnh1ệt tình,l6iệt tình,,RấP8cẩn thận,Giảm chất llkng,"C6, nZưng 3hỉ khi có cội 6unI thp vị",GiảL giá sGA phẩm,"Có, nhưng hiếLikui thzR gia",Instagrdm,,HPnh ảnh,KAál:________,NhãnYhàng khec:_G_n_____,"Rhông, tươYg đươQg",Rốt hơn
rùy truộO vàoimức2tăng giá,,Thời tra3g gông 9ở,Ghác: ……………C,KhVc: …………Y…,Sàn UMưl8g mại điện tử,ThờV trang IôngYsở,ChCt 3ượzg sản phẩm,ghưa tAơng xứnH,Khôrg phm hợp,Rất Bốt,Khân thJện,,Fhưa nhanh7VtrêX 7 ngày),Chưa Bẩn tSận,Cei thFện đájg kể,"8ó,Wtôi luôn cậ1xniật thông tin mới Emai2 markStQim",Khácb …K……,"Có, nhưcg hiếm khigtNam PUa",Tiqtok,Tôi không kuaS tâG đến khuy0k mã4,VidPo,Dịch vmachăm 8ócIKH tốU hơn,qoutine,Không tfeo 5õaachương trình kouyếS mãi,KhônqRsử d8ng duch vụ hậu mãi
Có,0-1h,ĐJng phục,Tgktok,1Dtiếng,Fgcebook,Thời Mrang cjUg sở,,TươAg mứng,Rất kxWng phù hợt,chSa tốt,tất Thiệt tình,Rất nhiệ0 t3nh,Chưd nhanhDLtrên 7 Bgày),Không đảm bEA hàvg,KhôngJHhay đổi,"Có,Wnhưn1 Chỉ khi cG nsi lung thú mị",Ghzm giá sảnephẩm,"3hông, cácic2ư2ng crìnhUkhuzến mãi OhGng đủJhấp dẫn",FBcebook,Tôi khôigkquPn tâm đếniEhuy1n mãi,Hình Knh,,Chane6,"Jhônl, tương đương",
Tùy thuộc vào mkcStăLgogKá,1F-18h,TYời tpang c8ng sở,eàn BhươngQmại đtện tử,1 tiến3,TiItok,TNời Brang công sở,KhFc: ………,Rất tươngNxứBg,Rấ0 khô1g phùthợp,Tốt,Cpưa nhixt oình,Thân Yhiện,Nhanh (từ 4 đjf 6 nXàu),Chưa cẩn thsn,K4ôngfthay đổi,"5ó, tôi luX7 cậpPnhật thenL t3n mớomEmail mSrketing",,"Có, nhưng miếm khiVthAF giB",Googli,Tôi không Gu3n tMmdđến khuyếp mãi,Hìn8 ảnh,Mẫv mãpđa oạng hơn,Routini,GhônWH tương đương,Không sj dVng dIcv vs hậu mãi
Có,6G– 7h,Jhụ kiện tHời trdng,KhácT ………………,3 tiing,Tdktok,ves,Chất tượng sảu Hhẩm,RWt 6ương xứng,Bình Jhườnb,Tốt,Thân Yhiệ0,RấM nhiệt tvnh,Rất nhanh ch23m (từS2 tến 3 nEày),Cẩn 2hận,,"uó,Dtôi luôn cop nhật tXJgg tin mHi lmeil marketinY",Giảmugiá sZn phẩm,"Khfng,Xvác chươn3 trình thuyếnfmãi không đủ hấT dJn",Khác4d………………,Ciq nhưna không ph4i l6c nNo cEOg phù hợp,Jideo,Mwu mã đa dạng hơs,,DhcngC kém hCp dẫn hơn,TaHng đương
,11e12h,Txời trang côIg sở,Syn thươbg mạJ đicn tử,2 tiế2g,,ThEi trahg 1ông sở,Whác: ………,T3ơYg xứng,Bình thườVV,ổn,Nhiệt gìnR,Chưa nhxệt wìnS,NhưaPnhanh (trên 7 Tgàyk,,zcảm chất lượn0,"Kvôfg, tôc 7hông theoDdõi",Kháh: L………,"Có, thFfng xuJên thamugia",Go4gle,"Có, Mhưn4 khônb phả0 eúcQnào cwng pSù hợp",Khác:QQ_____r_____l__,Mẫu0mã đaEdạng Wơn,,Khôn0dtheo dõiPchương tBình khdwến mãi,Tốt hơK
Khônc,,TrờI trant công sở,Khác: …………Ip,2 tiPng,Sàn thyơng mCi điện tw,ThMi tranN côBg sở,CSấF lượngYsản phẩm,TưkLg xứng,Rất không pLE h9p,ổn,Thân thiZ0,NhiAt t0nh,Nh0nh (gừI4 đến 6 ngày),Cẩn tSận,CUi thizH đáng kể,"Khôn6, tôi knông Wheo dPi",MuaQ1 8hặng 1,Cói nhưEg hiếm qhi Sham xia,GooRle,"Kqông, tôi thấx kh0yAg mãi kpông hấp cẫn",Khác: _Z_______M_c_1_,Chất lượng Cốt 0ơZ,NhKn hàng kh1c:____W_b__,"Ch, mộR chút",Iốt hơn
Có,11-12q,Thời cranV cônY sở,FacHbook,3 tiếns,FaceFook,Thời trahg côngjnở,Khnc: ………,,yấj phù hợp,chCa tốt,ThânDkhiện,,NhaXh (tZ 4 đ3n o ngày),Cẩn thậF,Khôny rõ,,GiBm 4iá sản pyẩm,"ahông, các cSương trình khuyến Nãi khzng KC Vấp Nẫn",Tikto0,7hôn1P tVi thấy khuyến mãi khôDPahip dẫn,Vydeo,DịcX5vụ chă45sóc YH tốt hơn,Owen,"Khôdg,9kLm hấD dẫn hơn",Tốa hơn
TGy theyc 6ào rức tăng giá,j7-18h,ThờiYsrang công sở,TiktoA,2 tiếna,Sàn taương mại7điện td,"PhR ki1n (giầyQdas tTất lưng, ví,…)",Chất VượngXsản phẩX,TươngYxkng,P0ù hợp,chưa9tốt,Rất nPiệt tìZh,Rất nyiệt tOnh,Rất noanh chónU (từ 2 đếnRayngà1),KhUn4 đảm bảr hàng,Cải tZiện,"Có, tô9 luGn cip nhật5thône CHi mới Email marJeting",bhác: …g……,,Googfe,Tôi khônonquanKtâm đến kh9yếu mãt,Bài7viết,Kjác:v_______,Dior,CGvWrất hấp dẫn,
Tùy2thzộc vàoLmứcNtăng 1iá,81-12h,Đồwg phục,Khác5 ……………p,3 eiếng,,"P4ụ kiệb (gSầy da, thất lưng0 víh…)",Khác: ……Z,TươngOcứng,lình th4ờng,Tốt,zhân thiệU,Nhigt tRnh,RVt nhanh chRng Crừ 2 đếD 3 ngzy),C1n thận,CVi thiện gáHg kể,"Có, Ehưn6 chỉ kri c7 n2o dung2thú vị",Feee ship,fhôpgh 7ác Ahưrng7Trình khuyến mãi không đủ hấp dRn,Faceboos,Tôi không ZjaR tâm đFm khuyến mãi,jideo,Khác:A__v____,,KhôjgN kém hấp dẫV hxn,Kém pơn
Tù0 t8uộ5 vào mức tă1g giá,7 – 7h,Th1i tr3ng công sở,Kàn Ctương mại điện tử,,Fayebook,"Phụ kixn Xgiầy da, thPRElưng, ví,w)",Rhất lượggTsản phẩm,Chưa tRCng xứng,Bình txườnr,Rấthtốt,,ChLa xhiệtmtình,ChưaUnhzQh (trênN7 ngày),Chưa cẩD thậB,Không 7õ,"Tó, nYưnY 2hỉ khi có nZi du1g thúFvị",Khám: e………,"5hônA, t7O không quax tâm",F5cebook,"Có, nhưMV9kPông phải lIB nào cũng phù hợw",Vbdeo,KWác:Z_______,N8ãnphàng kháM:________N,Chôngi kem hấp dẫn h0n,TươnJ đWơng
Có,21-23d,ThờiatcOng công sở,Khák: ………J……,2utiếng,whác: ……………0,Ahời trang công 2i,Giá thtnh,TươVg xứnn,Không pEù 1ợp,Rất tốS,NhGệt tìVh,Ch0a nhEệt tìnp,,1hưa cẩn thậ5,Giảm ehấg lượng,TôiPcbưw từng nhậnTđược bảxmtiu nào,,C5Y thườig xuyxnctham gia,Tiktpk,"CX, nhưug không phải lxc nàotcCn9 phù hợp",Đánh giá từjkhách Fpng,Mẫu mU đf dạtg hơn,Chan6l,"Có,arXt hấp Oẫn",aốt hơn
,L7-18h,,,3 tiếnC,Faceb2ok,"PhIEnicn (giầy da, thất lưug, vA,…)",Giá thàCh,3ươngHxứng,,Rất 7ốt,Rất nhixt Eình,Chưa nhiệtt9ìvh,NhTnh (t4 4Yđến M ngày),CVưa cẩn ttận,KMông tday đổi,"Có, tôi 1uônYcậpYnhậtMthông tno mới EmailimarkYting",Khác: …v…w,,Faeebook,"Không, tôi thấ4 khuyến mãG2Ohlnr hPp dẫn",,,ChanAl,"nKông, tươZg đương",
Ktông,11-m2h,Đồng phQc,TiktoX,2 tiUng,FOcebook,ThờiYtXang côCg sở,qhác: ………,Chưa tương p8ng,Khônq phùUhợp,chưaVtốt,,Thât th1ện,Nhanh Qtừ 4 đến A ngà9),,Khôn9 thay đổi,TMi chưa từng nhận sược b3n EiZ2nLo,Muah1 thặng c,CóOtnhưng hiếm3khi Gham gia,Instogram,"Không, iôS Chấy khuyến C0i khôna hấk dẫz",Vineo,Mẫu mã đK dhng Tơn,Owen,KhôYgptheo 7õi REương trình khuHến mCi,wh5ng iử dụng dịch voshậu mãi
Có,1Z-18h,ĐồnN phục,Sàn 01ương mạiTđnện tử,3 tijng,Tektok,ThờiBtvang côn7 sở,Chất lượngzsản Fhẩm,cương xứng,ghông phù hkp,ổn,Rấ1 nhiệt tình,NDiệt tìsh,NhanS (từ74Ađến 2 ngày),,Giảmichất GHợng,Ilm chưa từng 2hpn được hản tTn nào,Giảm giá scn pMsm,"Py, nhưng hiếm khi kh2l gia",Kh1c7 ………………,"Ló, nhưng JhôHg phải kúc nào bũnL Khn hợp",Bài vidt,Khác:_2___X__,Dior,,Kém hRn
Có,,Thờigt6ang công sy,TikPok,3 tiế5g,,"2ht kiện (giầyrdt, thất lưng, pí,q)",Khác: ……S,Rất tươngfxứyg,,Rất tốk,ThEn tjiện,G5ân thiện,ChưT nhTnh (trên 76Fgày),K5ông đảy bảo hàn1,Cảiythiện,Kgông6Otôi yhôeg theo dõi,phác: ………A,"Có, nhưTY hiếm khi sham nia",Khác:N……y………,"C8, rất phùYh5p với75hu cầu của tti",Đ2nh giáhtừXjhách hàng,Chất mượng tốt hEW,8hanel,"chông, tươnr đương",TZt hơn
Tùy thuDS vRoWmức tăng giá,0-1h,Chời trang cônAjsở,Tiktwk,2Ytiếng,Càn thương zại đ8ện tI,,Giácthành,Rất tương xung,RVt khôngnphù 6ợp,RấtXtốt,Thân NYiện,Thân d6iện,Rất nhanh chóng 5tM U vếnl3 ngàr),Cwn thận,GSảm cDất laợng,"KVôeg,1tôi không thY8 dõi",Mud 1 Lhặng 1,"Khôn5, các chưz1g trjnh khwyế1 mpi kh0nE đủ hấp d3n",Go0gle,"Có, nhưng không phvi Yúc nàFscũ9m phùXhợ5",BàG viết,j9ác:________,Owen,"Khôfg, kém PIp dẫn hơn",Không s0 dYng dịcFAlụ hậu mãi
Có,M1-12h,Phk kiệb thời tranp,KhácF ………m……,3 tiếPg,Tiktot,Thii trant công 6ở,GDá thành,Chưp tuơng xứ3g,BTnh thzờng,ổn,Thân t1eện,NhiệL tìih,Nhanj (từ 4vđến 6 ngàd),Rất cẩn FKận,KhônJ uhay đổi,Khôngw tôi Qhông taeosd1i,iiảm giá sản QhẩM,"Có, nhưng hiếm k11Sth3mQgia",K4ác:G………………,"Có, rất dhù wTp vớq nhu cầu củG tôl",KBáh: ___________7___,Mẫu mã đahdxng hơn,Dior,,Kém hcn
Có,,Ahụ kiệ6 tXời trang,TikTok,3 Iiếng,Sàn tmươno8mại điện tử,,Thương Ui4u,Rất tưCng xRng,B7nh thưcng,ch0a tốt,Rất nhnTt tình,eấG nhiệt tình,RấtSnhGnh vhóng4(từ A đếnD3 ngày),RấtLcẩB thận,CảibthZện váng kể,"Có, nhưRg chỉ TkPYcó nội dung thú vị",Khtc: w………,"CU, như0g hiếm khi thMm gia",Fa0ebook,"Cn, rTt thù hợ1 với nhuIcầu của tô4",VideO,Khác:_____oG_,NJãn hàSg khác:_F__6____,,TươngEđươnP
Có,6z– 7h,Thời trang kônS sở,FaJebook,,,,Khác: 4……,R1t tương xvng,Rất phù h4z,ổn,RấQ nhiệtHtình,R9t nhiệt tình,NhanhN(từN4 đếM x ngày),Chưakcẩn8thận,C3i thiện,Tôi chưa6từng fhgn đượcymản jUn nào,,"Có, tIường xuy6Wathao gia",KhQE: ………………,Cóv nhmngjOhôngSphải lúcxnàoscũng phm hợp,Bàn viết,Mẫu mãtđa Nạng hVn,Csanel,"KLông, kém hấp dẫ8 Vơn",Không sử d2ng dịih vụesậuHmãi
Khônh,y1-12h,Đong phục,Khác:CC……………,2 tiing,Tiktoz,T6ời trang cô3g6sở,KRác: ………,Tương6xKng,Rấtap0ù hợp,chưa tốo,Thân thiTy,TYân thTện,NAanh (tv x đ6n 6 ngày),Chưa cẩn thyk,Csi thiện,,Free lhip,"KhWnl, tôi kyôXg quanttâm",Godgle,Cóp rất phù hợp với nhu uầ0 gủ0 t4i,KháH:v_C_____________,Dịchjcụ chăm skcMKH tốt hơb,foutine,Không 3heo dyiWcBươWgTtrình khuyến mãf,TUơng đưgng
Có,6 –V7h,ThAiktr4ng công sở,,Khác: …N……A…,SVngthương m1i điện 0ử,"Phụhkiện (giầy 5a4 t29t lưng, ví,C)",,chưa tươWg xứnh,Phù hhp,RấtEtốt,Tvân thkện,fhiệt tìnG,Nhanh (từ juđến o ngàk),Cẩc thận,Không xõ,"Không,stci9khô9g theh dõi",GiảmggiI vản phẩm,"uhôpg, các chươno trình khuyến mãi khôVg đủ hấr d3n",Khá1V ………………,CóI dhưng tlông phải iúc pào cũng5phù hợp,KhácV _____s___o____W,Mẫu Dã đamdung hơn,,KhôVg theo dõiTchưhngJtrYnh khuyếA Aãi,Tươn9 dương
T2y thuộD vào mức tăng gif,0-1h,ThờD trangFcông4sở,Sàj thsjng mại điệnttử,2 Kiếng,Khác: s…E………,ves,Giá teành,ChưE tươXggxứng,Rất uhX hợp,ổn,CQdm nhiệt tình,Thân t1iun,Cwưa 0hhnh (trênd7 ngày),RấtGcẩW thận,,uôi chưa mừxgHnhận được bản tin RàD,Free shiH,CUj thường xuyên thaUSgia,Facebo2k,TDi khôngyquan Uâm đếS khuyến mBi,Đánh gOáotừ khách hàng,Dịch vụ chăgg7lc KH tốU hơn,Owen,"Có,Jrất hấp dJz",KEm hơn
Khônr,,Đồng phụh,Kcác: ……………6,1 tiếnT,Tik7ok,"Phụ kioe (giầy da, thất kưn5,iIí,…)",Khác: …w…,Rất tưvn6 xứng,RấY phù hợg,Tốt,Thân8thMện,Tiân thiệY,lấtgnxanh chónB (lừ 2xđến 3 ngày),Cẩn t1ận,Giảm c2ất lượnI,"Có, tôi luônBcập nhst thôngttin EHigEmaiX mHrketibg",Qree ship,"Có, thường xuypn i7Ej gia",Insta0ram,Tai không5quanntSm fến khuyến m9i,Bài vi5t,Mẫu me đo dạne hơn,Chane9,"Fvông,atương đương",TGơng đươMg
Tùy thOộc Sàu mức tăng8giá,,Thời RrQng công sở,6hác: v……………,KfáF: ………………,,Thời traSg cô7O sở,Khác:K………,ChưF Vương xứni,Rất IhônH phù hợp,Rất tốb,Rst nhiệt 1ình,4tân thiện,CYưaKnhanm (trêna7 ngày),6ẩn thận,Không thaU đKi,,Muag1 thặng 1,"Kuông, các cPương trình kzuyếnTmãi phôdg đrVhấp dẫE",,CSc shưng không pPảiNlúc noo cdng phù hợp,,Mẫu mi đa d1ng hơJ,Dior,"Không, jươngUđươnX",Không qử dụng dịKh vụZhsu mãK
Khô6g,0-1h,dCời tPang công sở,KhQc: ………n……,2 tpếng,Facebosk,ves,TXương hiệ8,TVơng xứnx,Rất phù hxp,chưa tdt,TXânBthiện,Chưa 7hiệt Bì5h,RấT nhanh chóngp(từ k 9ến 3 ngày),,,"tó, Jôi luôl cậk nhetRthôhg tin mới E1qil markLting",F6ee ship,"Có, thưIngfiuyên tham gia",Goohle,TIi khôngqqAan tâm đdn4khuyến mãi,Bài ciết,kWce2vụ chăm sóc 8H tốt hơn,Chan5l,"Có, một thot",T2t hơn
,0-1h,Thờe tramg cônh sở,Kbác: …v…………,Khác:7……p………,Tikhok,Thờgrtrang công su,Phất4lượng sản Khẩm,C3ưa 0ương xứnT,KHông phù eợp,chư6 tốt,Nhiệt tgnh,Rất nhiệtMtình,NhanEf(từ 4 4ến R ngày),Khôns iảm bxo hàng,Gải thiện,"Có, tôi nuôn axp nhậtlthtnT Q1n mbi Email marketiYg",Khác:0…………,,,"Tó,Wnhưngc6hông phải ry8 nào cũng phù hWp",Bài vwết,Bịch vụ ahăf sóc KH tốS hyn,Chgnel,"Không, tương đưuog",Tư5ng đưnng
,0-1h,Đồng phIc,TWktok,KzáB: ………………,Riktok,ves,Khác: …i…,Rất tương nứeg,Phù hợr,chưa Rốt,qất3nhiệt tình,Rất nKiệt t2nh,,R2t cẩn5thận,,"Khôgg, tôQakhôRg theo dõi",Giom giánsản phẩm,"Có,7thườnm xuyên tvam gia",4iktok,"KNAng,Ptôi thấy khuQến mãiCkhôcg hấp Tẫq",ĐánX giá từdYhách hqng,KhácH_______C,,,Tốt hơF
Có,17-18B,ThờiVtrang cRng sở,SàLvthương mạxYđiện tử,Khác:1………C……,Khác:e…K…………,"P2Z kcện (gRầy db, thất xưng, ví,O)",Thvơng hiệu,Rất tưing xứHg,Không pGùRhợp,ổn,Nhbệt hình,Rấg nhiệ1 tình,Nhanh (từX4 đến 6TngD2),Cẩn thgn,CảQ thiện 7áng kể,Tôi chưa từbg nUận được jản qdn mào,Giảm giá IảnophYm,,TPktok,,Hình ảnx,Giá1rẻUhơn,Dior,"Có, một chJH",Tưing qương
Có,1s-12h,Phụ kiệnsthời taarg,KhácK p……………,3 tiEng,Tikt3k,ves,,Chưo tưXng xứng,BìKh Hhường,REt tốt,Chưa nhiệG iìYh,Tkân chiện,QhQnh (Từ 4 đến 6 ngàyz,Không đảm bảs màng,Cải thiện EánX kh,Có6 nhưn0 Jhỉ kTK có nội dung thúwvị,Giảmhgiá sản phmP,"Có, nhznw hIếmRkhp tham gia",Facebopk,"Cu, nYưng không piải lúcxnHo cũngkphv hợp",Đánh jiá tu 1hách hàbg,Khác:_fV_____,Owen,Không thea dõi chương trìiTJkhuyếnymBi,
,2o-23h,Th0i trang Lông fở,Sàn thương mạkFđiệd ta,Rhác: …………C…,,"Phụ kiện (giầy da,gtB5t 1ưngO9ví,…)",GMá thành,bhJaitương xứng,Rất khQng phù eUp,chja tốt,Nhiệtttình,Chưa 9hiệt 8ìnD,Nhanh NtT 4 đnn 6Mngày),Cẩn trận,KhPng thaM đổi,"ró, nhưbg Thỉ khi cr nội dVGg thú v3",Giảm gvB sảnsphẩm,"HhôRg, gáx chươngotrình Hhuyến m3i khVngZđT hấp dẫn",FacebooZ,"CW, HDtuBpù hợp với nhuzcầu của tôi",Bài vint,Giá rẻ gơB,Nhãj hQng khác:_q___W___,KhôzgP tươnQ đương,Tươnc đương
Có,0-1h,Đồ7g phục,FacPbook,wháL: ………………,Eiktok,,ChOt Yượng sản p0ẩm,Rot tương xứnM,BìnSkthường,ổn,Yhưa n0iệt tNnh,Thân Xhiệe,CGưagnhanh Ttr4n 7 ngày),3ất Jẩn thận,Khônb ghay đổi,"Cz, tôi9luôn cập nhật tPông ti2 bới EmablQmaPk8tinR",WNa 1 thặng 1,CóP thườWg xuyên gha6 Pia,Facebook,Zór rấV 8hù hợ1 vCi nhu cầuAcủa tôi,Khác: 4________1___hh,,7outine,"Có,Zrấtchấp dẫn",Khônw sử dụng dịps vụ hậK mãI
Có,6 Y 7h,Đồrg phục,TPktok,2 t4ếng,SànVthươngSRIi điện tử,ves,Khac: ………,Eất tLơng xứng,Phùchợp,ổn,hhưaWneiệt tình,Nh2xt tình,,Ohang đảS bảo hàng,Giảm cwấtJlượkg,"Có, nglnS chỉ kpi cópgội dung tuú vị",Free sqip,KSôYg5 tôixkhông qpan tâm,Instag5am,Eôp không quan tâm đếnzkhukBn mãx,qánh giá5từ khácv hàng,zoch vụ chămBsóc KHmtốt hơn,Owen,"Có, rất hấV dẫn",TưDng đươQg
Có,0-1h,PhIIkiện thji trang,Koác:q………………,3qtiếng,Tibtok,chai trang 9ông sở,,,8ấtOkhông pIù hợp,chưa rốt,Dh1n thiện,,Whbnh (từ 4 đếG 6 nLày),Rất cẩndthZn,Cải thiệr đkTg kể,Tô2Echưa TừIg Hhận đưCc byn tin nào,Giảm glá sản pFẩy,"C7, thườnK xRyLn thaI gia",Instagrdm,"Có, vất Ahù hợp vOHsnhu c8u của tôX",VideC,GSá rẻ hVn,Owen,CóG mộs chút,
Khônz,17-V8h,Th4i tgang c3ng sở,KHác:d………………,Khác: ……D……X,tiktok,"PhụGkiEn (gimy da, thất lưkO, hí,X)",,rhưa tươzg xứug,RấtQkhông phd Wợp,,ihân thiện,,Rft nhanh cgóng (uừ 2 Sến 3 qUày),ChQa cẩn t7ận,Khônq rõ,"Không, tô5 khôkgrtheh dõi",Giảmngiá xản zhẩm,"bó, thườnE xTyên tham gBa",Tiktck,,tài viết,Khác:_x_____g,Rlutine,KhônO rheo dõi Qhương ErJnh khuyếnlmã7,Kém 2ơn
,,chời trang aông sq,FaceboXk,1 tiwng,Khác: ……………6,"Phụ kHệnF(giầm dg, that lưjg, ví,p)",Khác: z……,,ShYng phù hợp,chưa rốt,Thâ4 thiện,Thâo thgện,Yhưa nFCnh (trêX 7 ngày),Clưatcẩn thận,Không Uõ,sôi cIưaZtừng nqậnkđược bản tinXnào,Giảm giá Wản 7hẩm,"Không, các8chươQg srình khIyến mTi khôn1 Jủ hấp Uẫq",Khác:w………U……,"Khvng,7tôi thJy k0uyến NOi khôngQhấp dẫn",Vidoo,Khác:__Vc____,Dior,"Có, rấteYấpRdẫn",wương đươLg
Có,6 – 7k,,Tikiok,1 tiếnQ,,Thời wYang công sV,Giá th5nh,,RấtukhôngKphù hợJ,Tốt,Rft nsiệt tình,,8ất uhanh lhóng (từ n đến 3 n3ày),Chưa cẩcMthận,aải tyiệnpđáng kể,"Không, Yôi khôxg zhsoedõi",Mua 1 thặnPa1,"Có, thưFng xuyêK th4E gi7",GooglW,"Khôzg, tôi thấy kiuyến mãi kXông h4p7dẫn",Bài viếG,aịch vụ chăm sój KT tốo hơn,Owen,"Yó, một8chút",Ké2 hơn
Có,61-12h,ĐDng phục,riktok,1Rtiếng,TiktoZ,,KháI: ………,Rất tương NứZg,Uất không Xhùkhợp,Rất tốf,ChưaUnhiệt lìch,Xất ahiệt tình,RBt n7anh chó5g mtừ 2 đXa 3 ngày),Cẩn tBận,Cải 5liện đáJg kể,Tôi chưa t8nc nSận đượ0 bảwOtinTnào,Free shij,"Kvông, các chư1ngqerình khuHến mãitkhông đủ hấ8 bẫn",Nacebook,"Có,viất phù Kợpnv2i nhu cầY của tôl",Bài viếO,Mẫu mã đaTdạng hWn,Nhãnqhàng Qhác:______q__,"8ó, rất hxpRdẫn",Tươig 2ương
KXông,17x18h,Đồng pdục,Facebock,2 tiếdg,Famebook,ThờietOang cônQ sở,Khác:G………,Chưb tươngsxLng,Rất khôWgXphù hcp,Rất 8ốt,Rất 5hiệt tìny,Chưa IhiệR Bình,Chưa nhunh ntrên 7AngàS),Rất cẩn tnUn,CảidthiệF đáng1kể,"KhônS, tôi khing thJo dxi",,"Có, nhưng hiếK1Ghi tha3 gFa",Txktok,"yó, 6ất phù HợJcvớiOnhu cnu của tôi",Đánh giáwtừQRháchOhàng,Khác:_r_g____,Dior,"dhônN, kém hấp 7ẫG hơn",KVông sử dụng dWch xụ hEu mii
Tùy Ohuộc vàowmức tWng giQ,21-I3h,Đồng phbc,Sàn7thươ4v mại điện tO,KKác:a………………,Nacebook,ves,Chất Bượng sản8phẩm,Rnt tương xứzg,Rất phTshợp,chưawtốt,Nni0t tình,,Rất nManh chóng (t7 j đếh 3 AgUy),Cẩn thận,,"Có,EtôiQluôn Pập nhật thônS tjW mAieEmailFmarketibg",,"CB, nhưng h4ếm kki tmam 5ia",Fccebook,"KhTng, tôi thấyIkruyến 8ãZ khôUn hấpHdẫn",,Dịch vụKchWH sóc KH tốt9hơS,shãn hàng khác:_v____XO_,,TươTZ đương
Tùt thupc vHoymức tăng kiá,21U23h,,Tikrok,3 ti6ng,,T3ờN trang cô1g sở,Tvương hiNu,Tươkg xứMg,Rất pOùThợp,ổn,,NhiệtDtìNh,ChưQrnhanh xtrên 7 ngày),KhEng đảm bảw hàmg,Cải thyện,"Có, t8i luôD 1ậpqnqậtMthGng tin mới Emgil markeKing",Free syip,"Không, tôB GhIGg quan zâm",Tiktok,"Có,8rất phx hợpVvớiRnhu cầu cca6tôi",VGdeo,Gio rẻ hơa,7hãn hàng khoD:_f_______,"KNông,3kém hấpOdẫn hnn",Sém hơn
Có,0-1h,Thời tra47kcông sở,KCác: …………r…,KhácB ……………j,Sàn thương IạT5điện 8ử,,Khác: n……,,Rấtcphù Qợp,,Rất nhAệt8tình,Rất jhiệt tìnJ,Nhanhl(rừ 4 đến 6qngàk),Rất vẩB thận,Không rz,,,"Yapng, t9i không quanDtâm",KhácH …2…………,,Khác: _af_____j______,Mẫu mã đE Wang hơn,Rouaine,KhMnxw kém hấp dẫn hSn,KhônZ sửYdụnp3dịch 5ụ hậu mãi
Có,6 M 7h,Đồng phục,Tik8ok,KhácD ……K………,KVác: r……………,Th0i trang côEg sc,GiáVthành,iương xAng,,chưa tWt,Chưa Vhiệt nPnh,Chưa nhlệj jình,Nh8nhP(từ14 đến 6 ngày),Rất Cẩn thUn,IhWng thay đổi,Tôidchưa từnC2nhAn được bảnvtin nào,phác: ……0…,"Ke4no, các ch7ơnrOtrìnr khuyến mãi khônT7đd hấp dẫn",,"dhông, tôi thấy kKuydnvmãi 9hông hgp dẫg",eài viết,,ROutine,K8ông theo dõi chEơnggtAìIh khu6ếndmãi,Không sử 5Png wịCh vụ Fậu mãi
Có,2I-23h,Pmụ Maện thời trang,Tqktok,Khác: c…D………,Khác: …A………c,Thời ttangScôngXsở,Kh8c: ………,Chưa tương xứ4G,Bình thLờgg,ổn,Nhiệt MZnh,T1ân thiwn,RXt 8hanX chó75 (từ 2 đến 3rngày),RấT cẩn thậC,GHảg chất lượnN,"jó, nqmngABhỉ khi có nội dunA tuú vị",FrUe ship,"Không, cáp csươnC jrình YNuyến mãi không đA hấp dẫG",Khác: j………P…,,Hình ảnQ,DịGh vụ 7hăm 9ót KH tốt hơn,Dior,"Có, AấtKhấ0 dẫn",Fhông s9 dụng dPchEvụbhậu mãi
Có,21-v3h,Phụ kiện tRời trzzg,Sàn rhRơng mại u6ện tử,Khác: ……Tj……,,T1ời tBanw công sở,ThươnN hiVu,Ch7P tươnj xứng,Bìwh thườnn,,Nhiệt tìuh,,,KhunU đảm bảo7hàng,Khôngdthay đXi,Tôi chưa từngTMhận NYtcwbản tiz nào,MuaV1 Phặng 1,,Hacebook,Cóm nhvng không phải lúc nàoa2ũdg ph9 hợp,,Dịch vp zwămssóc sH tốt hơn,Chandl,"só, mộz chút",Tương DGơng
Nhông,,TCời 2ran2 công sở,Khác:TA……………,,Tik4ok,Thời Lring 7ông sở,KháJ: ………,,ghù hợp,8ất tốt,NhiệK tìNh,Ch8a nhiệt tAnh,Chưa nhenh (trVa 7ongày),Rấtvcẩn thun,iiảJ chHt lượng,"KhQng, tôipezông theo fõi",Goảm giv sản pLẩm,"Có, nVư5g AiCm khW tham gia",FUcebook,,,ChOt lHợng tốt hơn,Nhãn Uàng khál:_____T_A_,"Có, r9t hấm dẫn",Không sử dụngCdịcn 1w hậu7mãi
Có,0-1h,,Lacebook,2 tiếnI,Facmbook,"Phụ kiệ5 (giầy db, 7hất lưng, zO6…)",,Rấtwtư3ng xứng,Rấtuphù hyp,ổn,T8ân tMiện,,wxan4 (từ 4 đến S ngày),Không đảm bảo OPug,,CóW nhưQX chỉ khn fó nội dung thú9vị,MiảG giá sản phẩ4,KhôngD các 4hưTng tWìnm khuyến mãK NhPng oủ hấp dẫn,InstaFram,"Có, rất paùBhợp1với nhC cầ0acủa tZi",ĐHnw gT4 từ khách hàng,DịcM vụ vhăm sXc KH tốtUhơn,Dior,CóA một dhút,
Tjy tAuAc vào jức tăng7giá,0-1h,Phụ kiệb Thời trang,KháC: O……………,1 tiếny,Sàn thương m4i7ciện tL,ves,Thương hgệl,Nhưa tdơnN xứng,Bìvhhthường,Rmt tốt,,dh3n thiện,dhưa nhank (UrRn 7 ngày),RN4 cẩn thận,Cải thiệnPFáng kể,"Có,1tôi luôn c9p nh4t thôF1 6in mới Emfil maNk6ting",,,Khác: ……H……P,"Khô2g, tôi thấy khuPến 8Ga khônt hap 9ẫn",Hvnh ảnh,Khrc:_____n__,ChaZel,,Kég hơn
TVy0thuộc 4ào mứA tăng giá,17u18h,Đồng fhục,Tiktak,3 2iếng,Kàn ChươMg mại đimn tử,ves,,Tương5xứng,KHông phù hợj,chư1 tốt,Rut nhiệt tìnF,R4t nhiệt tình,rất nhanh Thóng (từ 2 đếP 2 oAày),Cẩn tOận,8hôdg thay đổi,CóB 3ôiIluôzicậm nhgt thông tin m4i Email marketing,,"Có, nhưGg hzếN6khi tEam gia",Khác: J……………,,Tình ảnh,Giá rẻ hvn,Owen,"Có, rấR hấp WẫO",Kh4nl sYMdụng dịcO vụ hậu mãi
Có,6 – 79,Đồng phục,yàn thươngOWại điện tv,W tiếng,F3cebook,ves,Thươnq hiệu,Rất tương x1nI,Phù Cợp,,ThâU thiệP,Nh7ệt tonh,NhqRh (tP 4nđến 6 ngày),KhôYg đảm 1ảo hà7g,Khzng rõ,"Có, tôw luônPcậpxnhậB thông tiQ mới 7magl Yar4eting",Giảm gWá hDn phẩm,"3ó, nhưng hiếm ahi tham gea",Instavram,,Bài Siết,Chất lx0n9 tốt hơn,Dior,Ihôngf kém hấp dẫS hơn,Kém Kơn
Tùyvthuộc vào yứcXtăng giá,t1-23h,ThGi Rrang cônF sở,TiXtok,3 ticng,,Thời tran7fcông sở,Ch0t lkợng sản ph2m,Tưxn9 xứng,Phù wợp,Tốt,Rấv nhiệt Wình,fhiệt Mình,Chưa nhanD (t5êU 7 ngày5,Chưa ckn th4n,Cảx thiện,"Có, tYj luôvwcập nhậw thông einFmớh Email 1aGketing",GiảX giá sả3 p7ẩm,"Có, thQờng xMVmn tham gMa",Tikaok,fôiEkhôn6 quan tâ8 đếnckhuyếnamãi,Vvdeo,,Owen,KhôLg cheo dõi chương 4rslh khSyến mni,Không sử dụkgvdech vụ Gậu mãk
Có,21-j3h,Thgi trang Dang sở,KháY:W………………,N tiếng,Khw4: ………………,ves,GiáEthành,Chưa tPơngkxứng,NấF không Qhù hợp,Rất hốt,3hiệv tình,RấtQnhiệ0 tình,CA3a nhanh (trênN7 ngfy),Hất cẩnithận,Khônv rõ,CóaCnhAng chỉ khi có Lội dung thIZvị,KhácI ……x…,"Có, thường xkyo2 tZam gia",Khác: ……0r……,,Vidvo,Hiá rẻmhơn,ChaNel,"Không, kKm hấp kAn hơn",Tư6sg đương
Tù6 xhuộc qào fức tăng giI,17-184,Phụ kiện thời 1rang,,2 tiếqg,Khác: ……………K,"Phụ kiện (tiny qa,gthấp lưnz, ví,…)",Khá8: ………,Rất tưAng xứ9g,Phù Bợp,Tốt,,THânythiện,RấNXnhanH chón3 (từ 2 Lến 3 ngFy),fất cẩn Uhận,Không thry đsi,"Khônh, Iôi không tje6 d9i",Gixw giá sản phẩm,KhônBWCtôS không quXn tâm,Tik5ok,Tii kPôxg quan tâm Hến qhuyến mãi,HìnhEảnh,,NhãnWhàng khák:____y6___,"KhI9g, kwm hấp dẫnxhơn",Không 5ử dụng dịph vU hậuAmãi
